date_time,record_id,summary
2000-01-29 00:00:00,7077ec572d50395cafcbcb7d,"The logs indicate frequent start and end events for parameter server (ps) tasks across multiple jobs, suggesting parallel initialization and termination phases typical in distributed training workloads. Several jobs, such as 25e9e5b64ce43a876a11073f and fabbb6143c2cf14a050160c6, have their ps tasks start and end in quick succession, demonstrating rapid job lifecycle transitions. The workload involving a BERT model (cf13c9d5843cde2f28f6fd90) shows a similar pattern of swift ps task execution, reflecting workload heterogeneity. Overall, the logs highlight dynamic resource allocation and concurrent job execution within the cluster, emphasizing the importance of efficient scheduling and resource management for large-scale distributed training."
2000-01-29 06:00:00,7077ec572d50395cafcbcb7d,"The logs indicate that multiple parameter server (ps) tasks, such as 10ff4e48d22dd25d0359092e and c46a462cc734807479ed9708, have successfully completed their execution. This suggests coordinated job execution within a distributed training or processing framework, likely involving synchronized tasks across multiple nodes. The orderly termination of these ps tasks implies effective resource management and job orchestration in the cluster. Such behavior is consistent with scalable machine learning workloads where parameter servers manage shared model states. Overall, the system demonstrates stable task completion and proper orchestration in a distributed environment."
2000-01-29 12:00:00,7077ec572d50395cafcbcb7d,"The log indicates the termination of a parameter server (ps) task within a distributed job, suggesting the completion or failure of a distributed training or computing task. This event may reflect resource reallocation, load balancing, or job lifecycle management in the cluster. Monitoring such task terminations can provide insights into system stability, fault tolerance, and workload distribution. The behavior aligns with typical distributed computing patterns where master or coordination components conclude after task completion. Further analysis of similar logs would help quantify system efficiency and identify potential bottlenecks or failure points."
2000-01-29 18:00:00,7077ec572d50395cafcbcb7d,"The log indicates that a parameter server (ps) task within job 9917aa7f428f336870024b10 has started, suggesting the initiation of a distributed training process. This reflects the typical operation in large-scale machine learning workloads, where multiple worker nodes coordinate via a centralized parameter server. The start of the ps task signifies system readiness for synchronized parameter updates and communication among distributed components. Operationally, this points to the deployment of a distributed computation framework that relies on task orchestration and resource allocation for scalability. Overall, the system behavior aligns with common practices in large-scale distributed training, emphasizing task startup and coordination."
2000-01-30 00:00:00,7077ec572d50395cafcbcb7d,"The logs depict multiple parameter servers (ps) starting and ending across various jobs, indicating active distributed training sessions. Notably, some jobs, such as ""7b8d85031d578f7cccdfac11,"" involve workload-specific tasks like GraphLearn, suggesting specialized model training. The presence of GPU type specifications, such as V100, highlights heterogeneous hardware utilization for resource optimization. The sequence of startup and shutdown events reflects typical distributed job lifecycle management, with parallel task execution and resource allocation. Overall, the data exemplifies typical distributed training workflows with heterogeneous hardware and workload-specific task handling."
2000-01-30 06:00:00,7077ec572d50395cafcbcb7d,"The logs indicate that multiple parameter server (ps) tasks are starting and ending in a non-sequential, overlapping manner, which suggests concurrent job execution and resource utilization. Several jobs (e.g., 31464de4abd9d31316649db4, aac6225a42a4bccc96e0aafb, 6e1db3c2c5b4b46d0c69611b) have both their ps tasks started and concluded, pointing to typical distributed training iterations or job lifecycle stages. The presence of multiple jobs with overlapping ps task activity implies a shared resource environment with potential concurrency. The pattern reflects standard distributed ML workload behavior, where parameter servers are dynamically managed and workload distribution occurs across the cluster. Overall, the system demonstrates typical high-throughput, concurrent job execution characteristic of large-scale distributed computational systems."
2000-01-30 12:00:00,7077ec572d50395cafcbcb7d,"The logs indicate multiple parallel ""ps"" (parameter server) tasks are transitioning between start and end states, implying active coordination roles in the distributed system. The repeated start-end cycles suggest typical job execution phases, with some tasks completing before others begin, reflecting proper scheduling and resource management. The presence of concurrent task states points to a multi-node environment functioning with synchronized task management. The sequence of task transitions demonstrates operational stability and effective task lifecycle handling within the cluster. These behaviors underscore the importance of robust task orchestration in maintaining distributed system efficiency and reliability."
2000-01-30 18:00:00,7077ec572d50395cafcbcb7d,"The logs exhibit multiple parallel ""ps"" (parameter server) job start and end events, indicating concurrent distributed training jobs. Job lifecycle transitions suggest active resource utilization with overlapping job executions, reflecting a typical distributed workload pattern. The presence of GPU type specifications, such as P100, highlights heterogeneous resource provisioning in the cluster. The pattern of frequent job restarts and terminations suggests dynamic job scheduling and possibly iterative training processes. Overall, the system demonstrates a balanced utilization of compute and GPU resources for scalable distributed machine learning tasks."
2000-01-31 00:00:00,7077ec572d50395cafcbcb7d,"The logs indicate a sequence of job and task transitions involving ""ps"" (parameter server) roles, with multiple tasks starting and ending in quick succession. The pattern suggests coordinated initialization and termination phases, characteristic of distributed training or processing jobs. The repeated start and end events imply dynamic resource allocation or failure/recovery cycles in the cluster. The presence of multiple concurrent ""ps"" tasks points to a distributed parameter management system vital for synchronization across worker nodes. Overall, the behavior reflects typical operational patterns in large-scale distributed machine learning or data processing workloads."
2000-01-31 06:00:00,7077ec572d50395cafcbcb7d,"The logs indicate a typical pattern of parallel processing with multiple jobs and task instances (ps) starting and ending asynchronously, reflecting distributed task scheduling and coordination. Task lifecycle events show frequent job turnover, with some jobs executing multiple start-end cycles, highlighting dynamic workload management. The presence of concurrent job executions suggests an environment optimized for high throughput and parallelism, characteristic of large-scale distributed systems. The sequential yet overlapping start and end events imply synchronized task execution and resource sharing across nodes. Overall, the system demonstrates robust parallel processing capabilities, critical for efficient large-scale data processing workloads."
2000-01-31 12:00:00,7077ec572d50395cafcbcb7d,"The logs indicate the lifecycle events of a parameter server (ps) task within a distributed job, with one task ending and another starting. This suggests a possible scale-up or scale-down operation, or task reinitialization to ensure fault tolerance. The transitions demonstrate active resource management and task coordination typical in large-scale distributed systems. The sequence highlights the importance of task synchronization and dynamic resource allocation in maintaining system stability during job execution. Overall, these behaviors reflect the system’s resilience and ability to manage distributed workloads efficiently."
2000-01-31 18:00:00,7077ec572d50395cafcbcb7d,"Two parameter server (ps) tasks from different jobs have started simultaneously, indicating parallel initialization of key components in the distributed system. This suggests the cluster is in the early stages of job deployment, possibly preparing for data processing or model training tasks. The concurrent start of multiple ps tasks emphasizes the importance of coordinated resource allocation and synchronization for scalable distributed operations. Such behavior reflects typical large-scale machine learning workloads that rely on parameter servers for distributed parameter management. Overall, the logs indicate an active setup phase within a distributed computing environment optimized for large-scale task orchestration."
2000-02-01 00:00:00,7077ec572d50395cafcbcb7d,"The logs indicate that the parameter server (ps) tasks for multiple jobs are alternating between start and end states, suggesting task lifecycle management and resource allocation. Specifically, job 8ffb5e56d0f688f185fed6b3's ps task has ended, while job 9ff31c1999b65ce1227703c4's ps task has started and subsequently ended, along with the completion of another job (53fef96dc02b54b9a68682fd). This pattern reflects typical distributed training workflows where ps nodes are dynamically scheduled and terminated based on job progress. The sequential start and end logs are crucial for monitoring resource utilization and task scheduling in large-scale clusters. These insights are relevant for optimizing cluster workload management and fault tolerance in distributed machine learning tasks."
2000-02-01 06:00:00,7077ec572d50395cafcbcb7d,"The logs indicate that multiple parameter servers (ps) and worker nodes are being launched and terminated at different times, reflecting typical distributed training job lifecycle events. The sequence shows some parameter servers starting and ending their tasks, suggesting dynamic allocation or potential job completion phases. A worker node was started and subsequently ended, implying a temporary compute resource involved in the workload. The pattern highlights coordinated management of distributed components, likely for machine learning training or large-scale computation. Overall, the system demonstrates typical resource scheduling and task orchestration behaviors in a distributed cloud environment."
2000-02-01 12:00:00,7077ec572d50395cafcbcb7d,"The logs indicate that multiple parameter server (ps) tasks are frequently initiated and terminated across different jobs, reflecting a typical distributed training workflow. Tasks often start and end in quick succession within the same job, suggesting parallel or iterative computation phases. The presence of overlapping job IDs and intermittent ps activity suggests a dynamic scheduling environment with concurrent job processing. The pattern of task start and end events demonstrates effective resource utilization and task execution synchronization in a large-scale cluster. Overall, the system exhibits standard distributed training behavior with active job management and resource coordination."
2000-02-01 18:00:00,7077ec572d50395cafcbcb7d,"The logs indicate a pattern of increasingly frequent parameter server (ps) and worker task initiations and terminations, suggesting dynamic scaling and workload variability. Several jobs involve synchronized start and end events for ps and worker tasks, reflecting typical distributed training workflows with coordinated task lifecycle management. The presence of multiple ps tasks starting and stopping in close succession implies a multi-parameter server architecture for distributed training or computation. The sequence of task states suggests efficient resource utilization and possible elasticity in response to computational demands. Overall, the system demonstrates typical distributed training behavior with emphasis on coordination between parameter servers and workers."
2000-02-02 00:00:00,7077ec572d50395cafcbcb7d,"The logs indicate frequent start and end events of parameter server (ps) tasks across multiple jobs, reflecting typical distributed training workflows. Several workload types, such as ""graphlearn,"" are explicitly mentioned, highlighting diverse task purposes within the cluster. The observed parallelism suggests a scalable setup with multiple concurrent jobs initiating and terminating ps tasks, indicating dynamic resource utilization. The pattern of overlapping task executions suggests efficient job scheduling and resource allocation strategies to support large-scale distributed tasks. Overall, the system behaviors showcase a well-managed environment capable of handling concurrent distributed computing workloads with varied operational and training phases."
2000-02-02 06:00:00,7077ec572d50395cafcbcb7d,"The logs indicate multiple jobs with their parameter servers (ps) starting and ending asynchronously, reflecting typical distributed training workflows. Several jobs show overlapping `ps` start and end events, suggesting concurrent job execution and resource sharing within the cluster. Notably, different workloads, such as ""graphlearn,"" are running alongside other jobs, implying multi-tenant and heterogeneous workload management. The frequent start and termination events for `ps` tasks highlight the dynamic scaling and scheduling behaviors common in large-scale distributed systems. Overall, the system demonstrates flexible resource allocation, concurrent job processing, and diverse workload execution typical in cloud-based distributed computing environments."
2000-02-02 12:00:00,7077ec572d50395cafcbcb7d,"The logs indicate multiple parameter server (ps) tasks initiating and completing at different times, reflecting typical distributed job coordination. The sequence demonstrates overlapping task executions, suggesting concurrent operations across nodes, which is essential for scalability and efficiency in large-scale distributed systems. The workload labeled ""graphlearn"" implies specialized machine learning tasks requiring high communication and synchronization among distributed components. The pattern of frequent starts and stops highlights dynamic resource utilization and potential load balancing strategies. Overall, these behaviors exemplify the coordination and concurrency aspects vital for managing large-scale distributed workloads in cloud environments."
2000-02-02 18:00:00,7077ec572d50395cafcbcb7d,"The logs indicate a typical distributed computing environment with multiple parameter servers (ps) and worker tasks starting and ending asynchronously, reflecting dynamic task management and resource utilization. Several workload types, such as GraphLearn, are identified, suggesting workload-specific scheduling considerations. The presence of multiple ps and worker task state changes highlights load balancing and fault tolerance mechanisms, with some tasks running concurrently and others sequentially. Task lifecycle patterns emphasize the importance of monitoring task states for optimizing job completion times amidst concurrent operations. Overall, the system demonstrates scalable, fault-tolerant orchestration of distributed tasks essential for large-scale processing."
2000-02-03 00:00:00,7077ec572d50395cafcbcb7d,"The logs indicate a highly concurrent environment with multiple jobs starting and ending their parameter server (ps) tasks in overlapping sequences, suggesting parallel processing and distributed workload management. Several jobs, such as `ba1a714eed2fa08af6037fb9`, explicitly specify GPU types like P100, highlighting heterogeneous resource utilization. The frequent start-end pairs reflect typical distributed training workflows with coordinated task execution across nodes. The consistent pattern of task initiation and completion signifies active job lifecycle management, potentially involving fault tolerance and resource scheduling mechanisms. Overall, these logs exemplify a scalable, resource-aware distributed system capable of managing numerous simultaneous training jobs with varying hardware specifications."
2000-02-03 06:00:00,7077ec572d50395cafcbcb7d,"The logs indicate multiple parallel start and end events for parameter servers (ps) across various jobs, reflecting typical distributed training workflows. Tasks such as job 18d58a3883ac04ad99e34801 and others show overlapping ps activities, suggesting concurrent job execution with shared resources. The repeated start/stop patterns imply active resource management and workload balancing in the cluster. The presence of multiple jobs with intertwined ps activities highlights the importance of efficient scheduling and synchronization mechanisms in large-scale distributed systems. Overall, the behavior underscores the typical dynamic and concurrent nature of parameter server operations in a distributed cloud environment."
2000-02-03 12:00:00,7077ec572d50395cafcbcb7d,"The logs indicate multiple distributed training jobs with parallel parameter server (ps) tasks, some associated with workload ""vgg"" and others with ""graphlearn."" The ps tasks for each job generally follow a start-end pattern, reflecting job lifecycle management, with no evident overlap or resource contention among different jobs. The consistent pattern of ps task initiation and termination suggests active orchestration and coordination typical of large-scale distributed environments. The dataset captures typical job execution flows, highlighting the orchestration of multiple concurrent distributed training workloads. These observations inform system reliability, job scheduling efficiency, and resource utilization in a large-scale cloud infrastructure."
2000-02-03 18:00:00,7077ec572d50395cafcbcb7d,"The logs indicate multiple job and task executions primarily involving parameter servers (ps) and workloads such as BERT, with frequent start and end events suggesting iterative or cyclic processing. The presence of OpenMPI Tracker tasks alongside ps tasks highlights distributed communication and synchronization activities typical in high-performance computing workloads. Several jobs involve repeated start and end sequences, implying dynamic resource allocation or recovery operations during distributed training. The workload-specific logs (e.g., BERT) show targeted parallel processing, emphasizing workload-specific resource management. Overall, the system demonstrates robust orchestration of distributed tasks and resource utilization, characteristic of scalable, large-scale machine learning training environments."
2000-02-04 00:00:00,7077ec572d50395cafcbcb7d,"The logs indicate frequent starting and ending events for parameter server (ps) tasks across multiple jobs, demonstrating typical coordination for distributed training or processing. Several jobs, such as 42b63246c3272463b15986a6 and 9a2957ea6f1d1001c90e7966, show parallel execution of ps tasks with quick succession, reflecting scalable, concurrent operations. The presence of reduce tasks (e.g., job d36f483566aa4707b0646923) suggests a multi-phase pipeline emphasizing data aggregation or model synchronization. The pattern of overlapping ps start and end events signifies a dynamic, distributed environment capable of handling multiple jobs simultaneously. Overall, the logs exemplify standard distributed system behaviors involving resource coordination, synchronization points, and concurrent task execution."
2000-02-04 06:00:00,7077ec572d50395cafcbcb7d,"The logs indicate frequent job and task state transitions, primarily focusing on 'ps' (parameter server) component activities, suggesting active parallel job processing and coordination. Tasks show both start and end events in rapid succession, highlighting a dynamic workload with multiple concurrent jobs. The distribution of task lifecycle events across various job IDs implies a scalable, multi-tenant environment with parallel processing capabilities. The absence of task failures or retries in the provided logs suggests stable system performance during the observed period. Overall, the system exhibits typical behaviors of a large-scale distributed cluster managing numerous short-lived jobs with coordinated parameter server roles."
2000-02-04 12:00:00,7077ec572d50395cafcbcb7d,"The logs indicate multiple jobs with parallel processing tasks (ps) that follow a start-end pattern, showcasing typical batch job execution workflows in distributed systems. Several jobs, such as 59eb0f9a38970a5caa3ca57b and 2ffc898e1350d39cad8475e0, exhibit quick succession of start and end events, reflecting efficient task scheduling and turnover. The presence of specialized hardware specifications, such as GPU type P100 for job a84896b78dd16eb78f0d85c4, highlights heterogeneous resource allocation crucial for high-performance computing. The coordinated start and end timestamps suggest synchronized task execution, essential for managing dependencies and resource contention in large clusters. Overall, the logs exemplify typical operational patterns in high-scale distributed job management, emphasizing resource utilization, hardware heterogeneity, and process concurrency."
2000-02-04 18:00:00,7077ec572d50395cafcbcb7d,"The logs indicate multiple parallel jobs with starting and ending events for parameter server (ps) tasks, suggesting a distributed training setup where ps roles handle model parameter management. Several jobs involve worker nodes, notably job 169e2e0ee7bdc8d4069eef85, which has both worker start and end events, reflecting active job execution. The presence of GPU-based tasks, such as job 7761814e3f30d433135deb2d, with specified GPU type (V100M32), highlights heterogeneous hardware utilization within the cluster. The pattern of frequent ps tasks starting and ending implies dynamic job scheduling and resource allocation, essential for scaling and efficient distributed training workflows. Overall, the logs demonstrate the orchestration of distributed training jobs with orchestration of multiple ps and worker tasks across varying hardware resources."
2000-02-05 00:00:00,7077ec572d50395cafcbcb7d,"The logs indicate multiple parallel start and end events for parameter server (ps) tasks across various jobs, suggesting active distributed training or computation workflows. Several jobs, such as 3f6162fa11d5a90c8ee6f070 and 958abbdd590ae9d76d9fe5a5, exhibit a typical pattern of ps task initiation followed by completion, reflecting scheduled epoch or task boundaries. Concurrent execution of ps tasks across multiple jobs demonstrates efficient resource utilization and parallelism inherent in large-scale distributed systems. The timing and overlaps imply effective coordination of distributed components, likely managed via a centralized control plane or orchestration system. Overall, this behavior exemplifies typical operations in scalable machine learning workloads with nested task execution patterns."
2000-02-05 06:00:00,7077ec572d50395cafcbcb7d,"The logs indicate multiple jobs and their parameters, with several tasks (ps) starting and ending asynchronously, reflecting a dynamic workload deployment in a distributed environment. Notably, some jobs such as ""817e184b3fb913af20a1feb3"" and ""0293e3a6fb1c57d5eb5a4d7b"" involve multiple concurrent task initiations, highlighting parallel processing capabilities. The workload ""bert"" appears to involve at least one specific job, suggesting task-specific resource allocation. The pattern of frequent task starts and completions suggests an efficient resource management with overlapping job executions, typical in large-scale distributed training or inference tasks. Overall, the logs demonstrate typical distributed job orchestration involving multi-task execution, workload diversity, and asynchronous lifecycle management."
2000-02-05 12:00:00,7077ec572d50395cafcbcb7d,"The logs indicate a pattern of repeated start and end events for parameter server (ps) tasks across multiple jobs, suggesting active resource management and job coordination in the distributed system. Each job appears to execute a paired set of ps start and end events, reflecting controlled task lifecycle management. The rapid succession of these events implies that the cluster efficiently handles multiple concurrent tasks, highlighting robust orchestration capabilities. The consistent ps task behavior across diverse job IDs signifies stable scheduling and resource allocation strategies for distributed training workloads. Overall, the system demonstrates reliable management of distributed job components, crucial for large-scale machine learning tasks within the Alibaba infrastructure."
2000-02-05 18:00:00,7077ec572d50395cafcbcb7d,"The logs indicate multiple parallel tasks involving ""ps"" (parameter server), ""worker,"" and ""ReduceTask"" components, reflecting a distributed training or processing job. Tasks are initiated and terminated in a staggered sequence, suggesting coordinated resource management and task lifecycle control. The presence of multiple ""ps"" started and ended events illustrates dynamic scaling or task reassignment within the parameter server cluster. The ""worker"" and ""ReduceTask"" activities imply stages of data processing or model training with distinct task phases. Overall, the system exhibits typical behaviors of large-scale distributed workflows with concurrent task execution and resource synchronization."
