date_time,record_id,summary
2000-02-22 00:00:00,7077ec572d50395cafcbcb7d,"The logs indicate multiple parallel processing tasks, with some jobs (e.g., 9a5f1f1af6e70fd4689ca781) transitioning from start to end, suggesting proper task lifecycle management. Several jobs (e.g., 9c6cba1c670b80b88b8c1603, dcf4c4d5710fd1a0a23af46b, 058c9e7cfca40589cf8d7e61) show both start and end events for tasks labeled ""ps,"" implying successful execution and completion of parameter server roles across different jobs. The sequence demonstrates typical distributed training workflows, with coordination of ps tasks to facilitate scalable machine learning tasks. The logs do not indicate failures or anomalies, reflecting stable operational behavior. Overall, the system exhibits expected lifecycle progression for distributed tasks within a large-scale cluster environment."
2000-02-22 12:00:00,7077ec572d50395cafcbcb7d,"The logs indicate the start and end of parameter server (ps) tasks, with one task initiating and two completing. This suggests active management of distributed model parameter synchronization, a critical aspect of large-scale training jobs. The sequential nature of task status updates reflects typical job lifecycle events in distributed systems, highlighting task scheduling and coordination. Monitoring such task transitions helps identify potential bottlenecks or failures in the distributed training process. Overall, the logs exemplify standard operational behaviors essential for scalable distributed computing frameworks."
2000-02-22 18:00:00,7077ec572d50395cafcbcb7d,"The logs indicate multiple parameter server (ps) tasks starting and ending at different times, demonstrating concurrent execution and resource sharing. The sequence shows job tasks initiating and completing in an overlapping manner, reflecting typical distributed training workflows. The pattern suggests dynamic task scheduling and possible load balancing across nodes to optimize cluster utilization. The frequent start/stop events imply active job management and responsiveness to workload demands. Overall, the system exhibits typical characteristics of scalable, distributed machine learning workloads within a cloud infrastructure."
2000-02-23 00:00:00,7077ec572d50395cafcbcb7d,"The logs indicate a typical lifecycle of distributed training jobs involving parameter servers (ps) and evaluators, with tasks transitioning from start to end. One workload involves BERT processing, showing explicit activity of ps tasks completing after starting, which suggests coordinated phase progression. The presence of evaluator start and end events signifies model validation steps within the training process. The sequence highlights the management of different job components across multiple nodes, reflecting workload orchestration and synchronization in large-scale distributed environments. Overall, the system demonstrates standard operational patterns for distributed machine learning workflows in a cloud infrastructure."
2000-02-23 06:00:00,7077ec572d50395cafcbcb7d,"The logs reveal a pattern of parallel start and end events for parameter server (ps) tasks across multiple jobs, indicating a distributed training or computing workload with concurrent job execution. Jobs such as 507dae2330bf93a400204cf1 and f6ab2044f9425065096267c4 demonstrate overlapping task lifecycles, suggesting the utilization of shared resources and potential for resource contention. The frequent start-stop cycles of ps tasks imply a workload with dynamic resource allocation or task rebalancing, typical in large-scale distributed systems. The system behavior exhibits a high degree of concurrency, reflecting the need for efficient scheduling, fault tolerance, and synchronization mechanisms to maintain consistency and performance. Overall, the logs exemplify complex orchestration in a large-scale, multi-tenant distributed environment supporting scalable machine learning or data processing tasks."
2000-02-23 12:00:00,7077ec572d50395cafcbcb7d,"The logs indicate multiple parallel ""parameter server"" (ps) tasks starting and ending across various job IDs, reflecting concurrent coordination activities typical in distributed training. Several jobs (e.g., 7252619244df4b4fcfdb6174, d59345a2b87d125e1aada616, a364c5d69f134fabcd0f90f0) show paired start and end events, suggesting active but sequential execution. The presence of overlapping ps tasks implies a multi-job environment with concurrent parameter synchronization, highlighting the system’s workload scheduling and resource sharing. Variations in task durations and start/stop sequences may indicate workload balancing or potential resource contention. Overall, the logs exemplify typical distributed training behavior with multiple tasks for different jobs executing in overlapping timeframes."
2000-02-23 18:00:00,7077ec572d50395cafcbcb7d,"The logs indicate multiple parallel and sequential start and end events for parameter server (ps) tasks across various jobs, demonstrating dynamic task lifecycle management in a distributed environment. Some jobs, such as job 5fbce2cd0c4d57b3b53fa9ee, start and end their ps tasks promptly, while others like job 2711f1094e433d5775ca15e5 exhibit overlapping ps task executions, reflecting concurrent task orchestration. The presence of specific GPU types, such as V100, suggests workload heterogeneity and resource specialization in the cluster. The frequent task state transitions imply efficient task scheduling and resource utilization, crucial for large-scale distributed training workloads. Overall, the logs showcase complex, multi-job orchestration with balance between resource allocation and task concurrency in a distributed setting."
2000-02-24 00:00:00,7077ec572d50395cafcbcb7d,"The logs indicate frequent start and end events for parameter server (ps) tasks across multiple jobs, reflecting typical orchestration in distributed training workflows. Job tasks appear to be initiated and completed in a sequence, with overlapping or consecutive execution, suggesting parallel processing and resource utilization. Workloads such as ""graphlearn"" imply specialized computational tasks requiring distributed communication and synchronization among tasks. The presence of multiple job IDs with both start and end events suggests dynamic job scheduling and resource allocation within the cluster. Overall, the system demonstrates the management of concurrent distributed tasks with orderly lifecycle transitions, indicative of a scalable large-scale infrastructure supporting machine learning workloads."
2000-02-24 06:00:00,7077ec572d50395cafcbcb7d,"The logs indicate that multiple parameter servers (ps) are frequently starting and ending tasks in a sequential and overlapping manner, suggesting dynamic resource allocation and job scheduling within the cluster. Several jobs, such as 37ec2362266315a485d5e142, eead2c68d04d7985b5c047b4, and fc5febfa1777725e29b5e706, exhibit rapid state transitions, reflecting high churn and potential load balancing activity. The overlapping execution of task start and end events demonstrates concurrent handling of multiple jobs, emphasizing the need for efficient resource sharing and fault tolerance mechanisms. The pattern of tasks starting and ending asynchronously across different jobs indicates a distributed environment with multiple independent workloads executing simultaneously. Overall, the system appears to support flexible and dynamic job scheduling, crucial for large-scale distributed training and data processing workloads."
2000-02-24 12:00:00,7077ec572d50395cafcbcb7d,"The logs indicate that the parameter server (ps) for job 728191521e9c3f254512868f initiated, while the corresponding ps for job e2466f75643cdd9a63fb3b9c completed. This suggests a sequential lifecycle of training components, potentially reflecting job coordination or resource allocation timing. The start and end events highlight job-specific task scheduling within the distributed system. Monitoring such events is crucial for understanding job completion and failure patterns in large-scale clusters. These insights can inform improvements in resource management and job orchestration in cloud infrastructure."
2000-02-24 18:00:00,7077ec572d50395cafcbcb7d,"Multiple parameter servers (ps) for various jobs are initiated and terminated asynchronously, indicating dynamic resource management during job execution. Some jobs, such as 19958dacab143fe2352a757e and a9d9b6348fb5b88bd71fae93, show complete start-end cycles, suggesting proper task lifecycle handling. Concurrent task operations imply potential overlapping workloads, typical in distributed training or data processing pipelines. The logs reflect a distributed system managing multiple jobs with multiple ps tasks, emphasizing the need for efficient coordination and resource allocation. Overall, the system demonstrates flexible and scalable resource utilization typical of large-scale distributed computing environments."
2000-02-25 00:00:00,7077ec572d50395cafcbcb7d,"The logs indicate the initiation and termination of parameter server (ps) tasks across multiple jobs, suggesting coordinated launch and shutdown sequences. Notably, there are overlapping periods where ps tasks start and end for different jobs, reflecting dynamic resource allocation and job management. The presence of worker task activity occurs after some ps tasks have completed, implying a progression from parameter server setup to worker execution. This sequence aligns with typical distributed training workflows where ps nodes are set up before workers commence computation. Overall, the logs reveal a structured job lifecycle with clear orchestration of ps and worker tasks in a distributed environment."
2000-02-25 06:00:00,7077ec572d50395cafcbcb7d,"The logs indicate a typical pattern of task lifecycle management in a distributed system, with multiple parameter servers (ps) starting and ending asynchronously, reflecting dynamic resource allocation and workload distribution. Several jobs involve overlapping pss and evaluators, suggesting concurrent training and evaluation phases. The frequent startup and termination of ps tasks imply elastic scaling or job failure/recovery mechanisms in place. The presence of evaluator tasks indicates model validation processes running alongside training tasks. Overall, the system demonstrates a high level of concurrency and scheduling flexibility essential for large-scale distributed machine learning workloads."
2000-02-25 12:00:00,7077ec572d50395cafcbcb7d,"The logs indicate multiple job instances with persistent start and end events for parameter servers (ps), suggesting coordinated resource management across tasks. Some jobs exhibit overlapping or closely sequential execution, implying possible concurrent workloads within the cluster. Notably, the job with workload labeled ""inception"" successfully transitioned from start to end, reflecting normal operational progress. The multiple ps lifecycle events suggest a typical distributed training or processing job setup, emphasizing the importance of synchronization and resource allocation strategies. Overall, the activity demonstrates standard distributed job execution patterns with well-defined task lifecycles and task coordination."
2000-02-25 18:00:00,7077ec572d50395cafcbcb7d,"The logs indicate multiple parallel launch and completion cycles of parameter server (ps) tasks, suggesting a distributed training workflow. The presence of worker tasks indicates workload distribution, with some workers (e.g., job 29276689f944f1026790eece) completing after starting, demonstrating task execution and resource utilization. Several tasks, such as those associated with job b208d1ff95fd86a3d47883ff and 8cb56a989ed85bc12d3e5228, highlight task lifecycle management across different nodes. The appearance of specialized tasks like MWorker signifies potential model or data management components. Overall, the logs reflect a typical distributed job execution pattern with concurrent task scheduling, execution, and completion across a cluster infrastructure."
2000-02-26 00:00:00,7077ec572d50395cafcbcb7d,"The logs indicate multiple parallel and sequential ""ps"" (parameter server) tasks across different jobs, demonstrating workload distribution and task coordination in a large-scale cluster. Several jobs initiate and complete ""ps"" tasks in quick succession, highlighting efficient task execution and resource utilization. The pattern suggests a typical distributed training setup where parameter servers are started and stopped as needed, reflecting dynamic resource management. The frequent start-end cycles imply effective task scheduling and synchronization mechanisms within the cluster. Overall, the behavior illustrates robust orchestration of distributed components to support scalable machine learning workloads."
2000-02-26 06:00:00,7077ec572d50395cafcbcb7d,"The logs indicate multiple parameter server (ps) tasks starting and ending across different jobs, reflecting typical distributed training operations. Some jobs, such as 96cc30a6129e930dd3c9ad25, show a complete lifecycle with the ps task starting and then ending, suggesting proper task execution and termination. Concurrently, the job 6077c6ecef3174d4cc855cc2, which involves a graphlearning workload, follows a similar start-end pattern, indicating workload-specific operational consistency. The pattern underscores the importance of robust task management to ensure coordinated distributed training workflows. Overall, the system demonstrates active lifecycle management of ps tasks across diverse jobs and workloads."
2000-02-26 12:00:00,7077ec572d50395cafcbcb7d,"The logs indicate a sequence of task state changes in a distributed computing environment, with the ""ps"" (parameter server) tasks starting and ending across multiple jobs. Specifically, one ""ps"" task in job d314c697ef3d994ab0dfc6be transitions from started to ended, while other ""ps"" tasks in different jobs either end without a start event or are not explicitly started in the logs. This suggests the orchestration of parameter server roles, critical for distributed training or computation, with some tasks completing asynchronously. The absence of start events for certain ""ps"" tasks may imply pre-initialization, delayed starts, or incomplete logging. Overall, these logs reflect typical task lifecycle behavior but warrant further investigation to ensure task coordination and consistency across the distributed system."
2000-02-26 18:00:00,7077ec572d50395cafcbcb7d,"The logs show multiple parallel start and end events for parameter server (ps) tasks across various jobs, indicating concurrent distributed task execution. Tasks appear to initiate and terminate in close succession, reflecting typical orchestration in large-scale distributed systems. There is no evident queuing or delays, suggesting stable resource availability and efficient scheduling. The distributed tasks are likely part of a synchronized training or data processing pipeline, common in cloud-based machine learning workloads. Overall, the system demonstrates typical behavior of a resilient, multi-tenant distributed computing environment managing numerous simultaneous jobs."
2000-02-27 00:00:00,7077ec572d50395cafcbcb7d,"The logs indicate multiple parallel startup and shutdown events of parameter server (ps) tasks across various jobs, reflecting dynamic resource allocation and task orchestration in a distributed environment. Several jobs, such as 2a5e2375edfe3f31d13a71c5 and 1852b15aecb0f2c0ea9e59b5, demonstrate quick sequential start-end cycles, suggesting short-lived or iterative computations. The presence of workload-specific tags (e.g., ""graphlearn"") and GPU specifications (e.g., V100) imply workload-aware resource provisioning. The system exhibits frequent task churn with numerous concurrent ps tasks, highlighting workload distribution and scaling behavior essential for large-scale training workflows. Overall, the logs reflect a typical dynamic, multi-job orchestration pattern in a high-performance distributed training environment."
2000-02-27 06:00:00,7077ec572d50395cafcbcb7d,"The logs depict a typical distributed training setup involving multiple parameter servers (ps) and worker nodes, with frequent start and end events indicating task lifecycle management. Several parameter server instances, such as those for jobs 4adf7fec0e168879d03a2cd8, 77486b1efe9e411f7c5a6ce6, and 49a389fc7dda4d72e9b0ea3d, are repeatedly initiated and terminated, suggesting dynamic resource allocation or fault recovery. The presence of GPU-specific tasks, notably with job 8d67b66771ee54afd1122c78 utilizing P100 GPUs, highlights heterogeneous hardware usage for computational acceleration. Worker nodes, such as job 51feb98e5578a81ab528877c, are involved in task execution, often coordinated with parameter servers, reflecting a typical parameter-server-based distributed training paradigm. Overall, the system demonstrates robust orchestration of distributed components with frequent lifecycle transitions, necessary for scalable AI workload management."
2000-02-27 12:00:00,7077ec572d50395cafcbcb7d,"The logs indicate that multiple parameter server (ps) tasks for the ""bert"" workload are starting and ending, suggesting active coordination among distributed components. The ps tasks for job fb7fbaeb8a82c929eabede7f and 4f4a2d3db2a797bc540bb5fe are both initiating and terminating, implying dynamic resource management or job scaling. A worker task (job 400b085163bcc3fa1be857d6) has commenced after the ps tasks, indicating the transition to the worker execution phase in the distributed training process. The sequential pattern reflects typical distributed training workflow with synchronized parameter servers and worker nodes. Overall, the system demonstrates orchestrated task management essential for scalable distributed deep learning workloads."
2000-02-27 18:00:00,7077ec572d50395cafcbcb7d,"The logs indicate multiple parallel training jobs with various job and task instances starting and ending at different times, highlighting a dynamic and concurrent workload environment. Several parameter server (ps) tasks are initiated and terminated independently, suggesting a distributed model training setup with multiple parameter servers managing model synchronization. The presence of multiple job IDs and task status changes reflects a multi-job scheduling system handling diverse tasks simultaneously. The pattern of task starts and ends suggests workload variability and possible resource scaling or job lifecycle management. Overall, the system demonstrates typical distributed training operations with concurrent job execution and asynchronous task management."
2000-02-28 00:00:00,7077ec572d50395cafcbcb7d,"The logs indicate multiple parameter server (ps) tasks starting and ending at different times, suggesting active coordination for distributed training jobs. Several worker tasks are initiated, with some completing shortly thereafter, implying dynamic scaling or job completion phases. The simultaneous start and finish of ps and worker tasks demonstrate typical orchestration in large-scale distributed systems. The observed patterns reflect efficient task scheduling and resource utilization, essential for maintaining throughput in big data workloads. Overall, the dataset reveals standard operational behaviors in containerized distributed training environments within cloud infrastructure."
2000-02-28 06:00:00,7077ec572d50395cafcbcb7d,"The logs indicate multiple parallel operations involving parameter servers (ps) and worker tasks, suggesting a distributed training process. Several ps tasks (e.g., for job c747dbdfbbaff2e0ec9c5a09 and 2dc1b18b3f64f5bf41acf883) started and ended, demonstrating proper lifecycle management of parameter servers. The worker task (job 1078a54e63d2b12d1403d9ce) initiated without a corresponding ps start, possibly implying dependency on existing parameter servers or a different orchestration pattern. The concurrent start and end times of ps tasks highlight typical synchronization points in distributed machine learning workloads. Overall, the logs reflect a coordinated distributed task execution with multiple parameter servers and workers operating asynchronously yet within a managed environment."
2000-02-28 18:00:00,7077ec572d50395cafcbcb7d,"The logs indicate the initiation and completion of parameter server (ps) tasks for two distinct jobs, suggesting active distributed training processes. Job d2e8405a64932405ce482808 shows a start and end for its ps task, implying a complete cycle of a communication or synchronization phase. Simultaneously, Job bdb0ca28e7e1be664fcae9ca running a BERT workload also involves ps tasks, highlighting the deployment of large-scale deep learning models requiring coordinated parameter updates. The pattern demonstrates typical distributed training workflows where multiple jobs manage parallel synchronous or asynchronous parameter exchanges. These observations reflect the system's capability to handle concurrent, resource-intensive distributed machine learning tasks across clustered environments."
2000-02-29 00:00:00,7077ec572d50395cafcbcb7d,"The logs indicate multiple parallel lifecycle events for parameter server (ps) tasks, with several tasks starting and ending at different times, demonstrating concurrent task management. A worker task associated with job 1078a54e63d2b12d1403d9ce has completed, while others, such as job c55315719bc7f34ed42029cc, are still in initial stages. The frequent start and end events of ps tasks suggest dynamic resource allocation and possible load balancing in the distributed setup. The varied job IDs and task instances reflect a workload with multiple jobs and task types executing asynchronously. Overall, these behaviors highlight efficient task scheduling and orchestration essential for large-scale distributed computing environments."
2000-02-29 06:00:00,7077ec572d50395cafcbcb7d,"The logs indicate a typical distributed job execution pattern, with multiple parameter servers (ps) and worker tasks starting and ending asynchronously. The sequential start and end events suggest coordinated job management, with ps tasks initializing before completing, and worker tasks following their start, possibly dependent on ps readiness. The presence of multiple jobs with overlapping ps and worker activities implies concurrent workload handling and resource sharing within the cluster. The consistent timing of task startup and completion demonstrates expected operational stability and task lifecycle management. These behaviors reflect standard distributed training procedures, emphasizing coordination, resource allocation, and fault tolerance in large-scale cloud computing environments."
2000-02-29 12:00:00,7077ec572d50395cafcbcb7d,"The logs indicate multiple parameter server (ps) tasks starting and ending for different job instances, such as 51d93b90e8cb3d25fcced08e, f176c00b2ec6a11f45dd5602, and cc39c1bc456354556211f6da, suggesting active management of distributed training workloads. The sequential start and end events imply typical job lifecycle operations, including initialization and completion phases. The workload labeled ""graphlearn"" appears to involve recurring ps operations, reflecting distributed data processing and model training activities. The pattern of task transitions indicates a well-coordinated, fault-tolerant job execution framework with multiple parallel tasks operating concurrently. Overall, the system demonstrates standard distributed training behaviors with managed task transitions across different jobs, suitable for large-scale machine learning workloads."
2000-02-29 18:00:00,7077ec572d50395cafcbcb7d,"The logs indicate multiple distributed jobs involving parameter servers (ps) and task-specific trackers, with several ps processes starting and ending at different times, suggesting dynamic management of distributed training workloads. Notably, the OpenmpiTracker job appears to run concurrently before completing, hinting at parallel or synchronized MPI-based operations as part of the distributed training pipeline. The pattern of ps jobs starting and stopping suggests resource allocation and deallocation activities typical in scalable distributed systems. Overall, the system demonstrates coordination among various components to facilitate large-scale distributed training or computation tasks, emphasizing the importance of job lifecycle management and synchronization."
2000-03-01 00:00:00,7077ec572d50395cafcbcb7d,"The logs indicate a pattern of task lifecycle events, with multiple parameter server (ps) tasks starting and ending in a sequential manner, suggesting periodic task execution or job scheduling. The repeated start and end events for specific job IDs imply that the system handles multiple concurrent or sequential distributed tasks, potentially representing either training or data processing workflows. The close temporal proximity of task completions and initiations hints at efficient resource utilization and rapid task turnover within the cluster. The consistent labeling of tasks as ""ps"" points to the use of parameter servers in a distributed training scenario, emphasizing the system’s focus on scalable machine learning workloads. Overall, the data reflects a typical distributed system’s operational rhythm with continuous task orchestration and management."
