date_time,record_id,summary
2000-01-12 12:00:00,7077ec572d50395cafcbcb7d,"The log indicates that a parameter server (ps) task associated with job 6ac3373981df75c945f071d8 has been initiated, suggesting the deployment of a distributed training job. This begins the setup phase for a large-scale machine learning workload, highlighting resource allocation and task scheduling aspects. The initiation of a ps task typically involves coordination for synchronized parameter updates across worker nodes, impacting network bandwidth and latency considerations. Monitoring such logs is essential for understanding job progression, failure points, and resource provisioning in distributed environments. Overall, this snapshot demonstrates the early stages of orchestrating a distributed training operation within a cloud infrastructure."
2000-01-13 12:00:00,7077ec572d50395cafcbcb7d,"The logs indicate a series of job and task lifecycle events involving multiple parameter servers (ps) and worker nodes, highlighting the typical orchestration in a distributed training environment. The parameter servers generally start before the associated tasks complete, demonstrating the coordinated initialization and shutdown phase essential for stable distributed training. Several jobs appear to run concurrently, reflecting a multi-task scheduling scenario common in large-scale distributed systems. The absence of worker task logs suggests that workers either started earlier or are managed separately, emphasizing the importance of synchronization between ps and worker nodes. Overall, these logs exemplify standard operational patterns like job coordination, resource management, and task lifecycle control in a distributed computing cluster."
2000-01-13 18:00:00,7077ec572d50395cafcbcb7d,"The logs indicate frequent initiation and completion of parameter server (ps), worker, and MWorker tasks across multiple jobs, reflecting a typical distributed training workload. Tasks often follow a start-end pattern, with some jobs (e.g., 3614b061b82d782b7f51176b, 09630c277578877d1846e97c) showing parallel execution of ps tasks, suggesting distributed parameter management. Worker and MWorker tasks are also initiated and terminated, indicating coordinated worker-group operations for training tasks such as graphlearning. The presence of both batch-specific and workload-specific jobs suggests dynamic task scheduling and resource utilization within the cluster. Overall, the logs depict a standard distributed training environment with concurrent task execution and resource coordination."
2000-01-14 00:00:00,7077ec572d50395cafcbcb7d,"The logs indicate multiple job and task lifecycle events, primarily focusing on parameter servers (ps) and workers in a distributed training environment. Several parameter server tasks started and ended sequentially, suggesting coordinated management of distributed model parameters. Some jobs (e.g., 47c92d4b2c99d3264e841560, a10fd8f851da940078709f54, bd44e52af7a035f03e371320, 3368660c3122e718bdae5059, b4c0bcaaa5c789b2d57f34f7, 41c26dd946999025b2b58aea) show cycles of startup and shutdown, indicating dynamic resource or task reallocation. The sequence and concurrency of these events reflect typical distributed training or computation workflows involving multiple synchronized tasks. Overall, the logs highlight orchestrated task lifecycle management essential for large-scale distributed ML training processes."
2000-01-14 06:00:00,7077ec572d50395cafcbcb7d,"The logs indicate multiple parallel executions of parameter server (ps) tasks across various jobs, with overlapping start and end times, demonstrating concurrent distributed training processes. Tasks for different jobs frequently start and complete in close succession, reflecting high throughput and potentially dynamic job scheduling. The sequence shows both short-lived and longer-running tasks, suggesting varying workload intensities and resource utilization. The consistent pattern of task initiation and completion supports operational stability and coordinated task management in a large-scale distributed environment. Overall, the system exhibits robust handling of concurrent distributed processes typical in cloud-based machine learning workloads."
2000-01-14 12:00:00,7077ec572d50395cafcbcb7d,"The logs indicate multiple parallel ""ps"" (parameter server) tasks with varying start and end times, suggesting a distributed training workload for a machine learning task, notably with the workload ""graphlearn"" identified in one instance. Tasks experience frequent start-end overlaps, reflecting concurrent execution typical in large-scale distributed systems. The presence of multiple independent tasks implies a high degree of parallelism and resource sharing across nodes. The workflow includes task initiation, execution, and completion phases, demonstrating typical job lifecycle management in distributed environments. Overall, the data highlights the complexity and concurrency inherent in large-scale distributed training and processing tasks on cloud infrastructure."
2000-01-14 18:00:00,7077ec572d50395cafcbcb7d,"The logs indicate multiple start and end events for parameter servers (ps) and worker tasks, suggesting concurrent execution and job lifecycle management within a distributed system. Several worker tasks (e.g., 081cc4bf1496c059a1ab0920, 354f10dab53948e7da50aa1d, 6f7fcc879d8130f603b9cce8) have clearly defined execution windows, implying proper task scheduling and resource allocation. The presence of multiple ps and worker start/end pairs reflects a typical distributed training setup with coordinated initialization, execution, and shutdown phases. The variation in task durations suggests potential differences in workload or resource availability affecting task completion times. Overall, these logs exemplify the operational flow of large-scale distributed training jobs, emphasizing task orchestration and the management of compute resources across nodes."
2000-01-15 00:00:00,7077ec572d50395cafcbcb7d,"The logs indicate frequent starting and ending of parameter server (ps) tasks across multiple jobs, reflecting typical distributed training workflows. There is a pattern of multiple ps tasks running concurrently within the same job, showing parallelism in workload distribution. Job lifecycles are relatively short, with rapid task turnover, suggesting efficient resource utilization. The workload labeled ""graphlearn"" appears in multiple instances, indicating repeated use of the distributed learning framework. Overall, the system demonstrates dynamic task scheduling and high concurrency typical of large-scale distributed training environments."
2000-01-15 06:00:00,7077ec572d50395cafcbcb7d,"The logs indicate concurrent execution of multiple parameter server (ps) tasks across different jobs, suggesting a distributed training environment typical in large-scale machine learning workloads. Several jobs transition between started and ended states without apparent delays, implying efficient task lifecycle management. The overlapping job activities highlight the system's capability to handle multiple distributed tasks simultaneously without significant resource contention. The absence of failure or error messages suggests stable operation during this period. Overall, the system demonstrates robust support for parallel distributed job execution, essential for scalable data processing and model training."
2000-01-15 12:00:00,7077ec572d50395cafcbcb7d,"The logs indicate multiple parallel and sequential task executions, with several jobs starting and ending their parameter servers (ps) in a staggered manner. Tasks such as ps for different jobs sometimes run concurrently, reflecting typical distributed training workflows with overlapping job lifecycles. The pattern suggests a dynamic environment with frequent job submissions and terminations, requiring robust resource management to handle concurrent workload scaling and scheduling. The variability in job durations and simultaneous ps operations implies the need for efficient coordination and fault tolerance mechanisms in the distributed infrastructure. Overall, the data highlights complex dependency management and resource allocation challenges inherent in large-scale distributed systems."
2000-01-15 18:00:00,7077ec572d50395cafcbcb7d,"The logs indicate typical coordinated activity between parameter servers (ps) and worker tasks in a distributed computing environment, with multiple workers starting and ending their tasks, suggesting parallel job execution. The ps nodes also follow a start-end pattern, reflecting their role in maintaining and updating shared model state. The synchronization appears to occur smoothly, with clear task completion signals, indicative of effective task scheduling and resource management. The sequence suggests a well-structured job lifecycle, supporting scalability and fault tolerance. Overall, these behaviors demonstrate organized task orchestration vital for large-scale machine learning workloads."
2000-01-16 00:00:00,7077ec572d50395cafcbcb7d,"The logs indicate multiple parallel ""ps"" (parameter server) tasks starting and ending across different jobs, demonstrating typical distributed training workflows. Worker tasks, such as in job d8fea75680e98edd9ebdd7c, also initiate and complete, highlighting concurrent computation phases. The presence of workload-specific jobs, like graphlearn, suggests workload diversity and task specialization within the cluster. Overlapping start and end events across jobs reflect a multi-tenant, highly concurrent environment supporting distributed machine learning workloads. Overall, the system exhibits typical distributed synchronous or asynchronous training patterns with multiple task lifecycles occurring simultaneously."
2000-01-16 06:00:00,7077ec572d50395cafcbcb7d,"The logs indicate that multiple parameter server (ps) tasks are starting and ending asynchronously, suggesting a distributed job with parallel task execution. The staggered start and end times reflect typical coordination in distributed training workflows, where parameter servers manage shared state across worker nodes. Such behavior highlights the importance of resource allocation and synchronization mechanisms in large-scale clusters. Monitoring these lifecycle events can help identify potential bottlenecks or load imbalances during distributed training. Overall, these logs exemplify standard operational patterns in distributed machine learning workloads on cloud infrastructure."
2000-01-16 12:00:00,7077ec572d50395cafcbcb7d,"The logs indicate multiple job and parameter server (ps) tasks starting and ending in quick succession, suggesting active parallel processing and workload distribution. Specifically, two jobs (""ab4f636f47665ece070ccfff"" and ""c6b8b98d12654a23b0146c28"") involve ps tasks that alternate between start and end states, reflecting typical synchronization and communication cycles in distributed training. The workload labeled ""graphlearn"" associated with the second job points to graph-based machine learning workloads requiring frequent coordination among distributed components. These patterns highlight dynamic resource management, task coordination, and workload diversity within the cluster. Overall, the system demonstrates typical distributed training behavior with emphasis on synchronization and workload throughput."
2000-01-16 18:00:00,7077ec572d50395cafcbcb7d,"The logs indicate a typical distributed job execution pattern with multiple parameter servers (ps) starting and ending their tasks asynchronously, alongside worker and MWorker tasks. Several ps tasks initiate and complete without direct dependency on each other, suggesting parallelized parameter management. Worker tasks frequently start and end in tandem with their associated ps tasks, highlighting coordinated training phases. The appearance of MWorker tasks implies multi-worker training scenarios, with their start and end times suggesting scheduled execution windows. Overall, the system demonstrates a multi-stage, parallelized distributed workload with coordinated task lifecycle management across nodes."
2000-01-17 00:00:00,7077ec572d50395cafcbcb7d,"The logs indicate a series of synchronized job and task activities, predominantly involving 'ps' (parameter server) roles, with frequent start and end events suggesting active coordination and task management. Several jobs, such as 7f63248e25d4a8e433d9672e and 0f30f37384a892453e8a7371, exhibit rapid sequential task lifecycles, implying efficient task scheduling or completion. The presence of worker tasks, like d0b75df6e7a1ed0a51b094a4, indicates parallel processing components, with clear start and end points denoting controlled execution phases. The consistent pattern of task transitions reflects typical distributed training or processing workflows, emphasizing the importance of synchronization for system stability. Overall, the logs demonstrate effective coordination between parameter servers and worker tasks, critical for large-scale distributed computing environments."
2000-01-17 06:00:00,7077ec572d50395cafcbcb7d,"The logs indicate multiple parameter servers (ps) are starting and ending in a distributed job workload labeled ""graphlearn,"" suggesting dynamic task scheduling and resource management. Several jobs have overlapping durations, with some tasks initiating before others complete, demonstrating parallelism in workload processing. The frequent start and end cycles of the ps tasks imply a potentially iterative or phased training process, possibly involving synchronization points. The presence of multiple jobs with different identifiers points to a multi-tenant or multi-task environment within the cluster. Overall, the system exhibits typical distributed training behavior with concurrent task execution and resource reallocation."
2000-01-17 12:00:00,7077ec572d50395cafcbcb7d,"The logs indicate multiple parallel jobs with start and end events for parameter server (ps) tasks, reflecting a distributed training workload involving machine learning models like BERT and GraphLearn. Several jobs, such as 38de04b47d12b55e7cb78d75 and 61504316a396766993471f4d, show overlapping ps activities, illustrating concurrency in task execution. The presence of specialized workloads (e.g., BERT, GraphLearn) suggests the cluster handles diverse large-scale ML tasks requiring high resource coordination. Some jobs, like 924436c4bab84db59937aa66, show the initiation of tracking or distributed communication components (OpenmpiTracker), indicating emphasis on managing distributed communication overhead. Overall, the logs reflect typical distributed training sessions with synchronized ps activities and workload-specific job orchestrations."
2000-01-17 18:00:00,7077ec572d50395cafcbcb7d,"The logs indicate a typical distributed computing environment with multiple jobs initiating and terminating various task types, including parameter servers (ps), workers, and specialized tasks like MWorker and OpenmpiTracker. Tasks are often sequentially started and ended, reflecting coordinated job execution and resource utilization. The presence of overlapping task lifecycles suggests concurrent execution and dynamic resource scheduling. The logs also show that different task types (ps, worker, MWorker) have varied durations and overlapping periods, highlighting the complexity of managing heterogeneous workloads at scale. Overall, these behaviors exemplify the execution patterns and resource coordination challenges common in large-scale distributed systems."
2000-01-18 00:00:00,7077ec572d50395cafcbcb7d,"The logs indicate a typical distributed job execution pattern involving multiple parameter servers (ps) and worker nodes, with tasks consistently starting and ending in a coordinated manner. Several jobs, such as the one associated with workload ""resnet,"" demonstrate parallel initialization and termination of ps and worker tasks, suggesting workload-specific resource utilization. The presence of chief tasks implies hierarchical orchestration, likely for job coordination or cleanup. The frequent start/end transitions reflect dynamic resource scheduling and cluster scalability, integral to large-scale distributed training workflows. Overall, the logs illustrate effective task management and coordination essential for distributed machine learning workloads."
2000-01-18 06:00:00,7077ec572d50395cafcbcb7d,"The log indicates that the parameter server (ps) task within the job named 5e85fccaefc8eae189a5e0fd has completed execution. This suggests that the distributed training or computation task involving multiple nodes has progressed to a stage where key coordinating processes have finished. The completion of the ps task may trigger subsequent phases such as worker task synchronization or final aggregation. Monitoring task lifecycle events like this is essential for understanding job progress, resource utilization, and potential bottlenecks in distributed systems. Overall, this behavior reflects typical operational patterns in large-scale distributed machine learning workflows."
2000-01-18 12:00:00,7077ec572d50395cafcbcb7d,"The logs indicate frequent start and end events for parameter server (ps) tasks across multiple jobs, reflecting dynamic resource allocation and job scheduling in a distributed setup. Tasks tend to start and terminate in quick succession, suggesting a workload with short-lived or iterative phases. The sequential completion of ps tasks within individual jobs implies coordinated task management and possible synchronization points. The system appears to handle multiple concurrent jobs smoothly, maintaining task lifecycle consistency. Overall, the behavior demonstrates typical distributed job execution with efficient resource utilization and task lifecycle management."
2000-01-18 18:00:00,7077ec572d50395cafcbcb7d,"The logs indicate multiple parallel and sequential job executions involving parameter servers (ps) and worker nodes, with clear start and end points for each task, suggesting coordinated job workflows. Worker tasks frequently initiate and conclude, reflecting active computation phases, while the parameter servers manage the coordination and synchronization of model parameters across tasks. The presence of dedicated master worker (MWorker) sessions points to a hierarchical task orchestration framework ensuring fault tolerance or centralized control. The timeline hints at concurrent job execution with overlapping phases, underscoring the need for efficient resource scheduling and load balancing in distributed environments. Overall, the system demonstrates standard distributed training operations with distinct phases for parameter synchronization and workload execution."
2000-01-19 00:00:00,7077ec572d50395cafcbcb7d,"The logs indicate frequent start and end events for parameter server (ps) tasks, suggesting dynamic scaling or resource reallocation during the execution of graphlearning workloads. Several jobs, such as 084c6248980e20b719f4a10d and cb4ddacd36037f30cf95f4f7, exhibit quick turnover of ps tasks, implying potentially short-lived or elastic resource provisioning. The presence of worker tasks, such as the MWorker, indicates distributed training or processing phases, though only one worker’s activity is logged. The tight sequencing of ps task lifecycles points toward orchestrated job execution with centralized parameter management. Overall, the system showcases a typical distributed training pattern with rapid task scheduling and cleanup."
2000-01-19 06:00:00,7077ec572d50395cafcbcb7d,"The logs indicate frequent start and end events for parameter server (ps) tasks across multiple jobs, reflecting standard distributed training coordination. Some jobs specify specific GPU types (e.g., V100), suggesting hardware heterogeneity considerations. Workload-specific logs (e.g., for BERT and GraphLearn) imply multi-model or multi-application environments running concurrently. The sequence of task lifecycle events demonstrates typical job orchestration, with each job’s ps tasks starting and ending in a manner consistent with distributed training workflows. This dataset provides insights into resource utilization, workload diversity, and operational patterns essential for large-scale distributed training management."
2000-01-19 12:00:00,7077ec572d50395cafcbcb7d,"The logs indicate multiple parameter servers (ps) frequently starting and ending tasks, suggesting ongoing coordination and synchronization activities across distributed nodes. The intermittent task transitions imply dynamic workload distribution and potential resource reallocation. The presence of a workload labeled ""graphlearn"" highlights a specialized distributed training job, possibly involving complex graph computations requiring synchronized parameter updates. Overall, the system demonstrates typical scaled training operations with multiple concurrent ps sessions, indicating a high level of parallelism and coordination. The pattern of ps activity reflects the dynamic and fault-tolerant nature of distributed training pipelines in large-scale cloud environments."
2000-01-19 18:00:00,7077ec572d50395cafcbcb7d,"The logs indicate layered task execution across different job components, with a clear sequence of 'started' and 'ended' events for parameter servers (ps), workers, and MWorkers, reflecting task lifecycle management. The ps tasks show frequent start-end cycles, suggesting dynamic resource allocation or scaling within the parameter server role. Worker and MWorker tasks exhibit parallel execution patterns, implying concurrent processing designed to optimize distributed workload throughput. The mix of long-running and short-lived tasks points to diverse job types and possibly stages of job execution, such as initialization, training, or cleanup. Overall, this indicates a typical distributed training environment with coordinated task orchestration, resource management, and parallelism for large-scale model training or data processing."
2000-01-20 00:00:00,7077ec572d50395cafcbcb7d,"The logs indicate a pattern of parallel processing where multiple parameter servers (ps) are sequentially starting and ending, suggesting coordinated task execution in a distributed environment. The timeline shows that job tasks initiate and complete in a staggered manner, which is typical for large-scale distributed training jobs involving parameter synchronization. The presence of multiple job and task identifiers demonstrates concurrent job management, reflecting workload multiplexing on shared infrastructure. The operational pattern suggests effective scheduling and resource utilization, key for optimizing training throughput and minimizing latency in distributed machine learning workflows. Overall, the system appears to support scalable, fault-tolerant execution with appropriate task lifecycle management."
2000-01-20 06:00:00,7077ec572d50395cafcbcb7d,"The logs indicate multiple parallel job operations, primarily involving ""ps"" (parameter server) tasks, with some jobs explicitly associated with the workload ""graphlearn,"" suggesting diverse workload management. Job start and end events show frequent, overlapping execution cycles, highlighting high concurrency and task scheduling activity typical in distributed systems. The presence of multiple jobs with similar task types and overlapping timelines implies effective resource utilization and parallel task distribution efforts. The dataset appears to monitor task lifecycle events crucial for analyzing system throughput, fault tolerance, and resource contention in large-scale distributed computing environments. Overall, the system demonstrates orchestrated parallelism with significant workload heterogeneity, emphasizing the importance of efficient task scheduling and resource management for large-scale cloud-based clusters."
2000-01-20 12:00:00,7077ec572d50395cafcbcb7d,"The logs indicate frequent start and end cycles of parameter server tasks across multiple jobs, suggesting ongoing distributed training or parameter synchronization processes. Tasks are initiated and terminated in quick succession, implying a dynamic workload with rapid job turnover or iterative processing. The concurrent execution of multiple parameter server tasks highlights parallelism essential for scalable distributed computing. The absence of explicit failure indicators suggests stable operation during the observed period. Overall, the system demonstrates active, concurrent management of distributed tasks, typical of large-scale machine learning workloads or distributed data processing pipelines."
2000-01-20 18:00:00,7077ec572d50395cafcbcb7d,"Multiple worker tasks (d501ce9c6d2bad45cda5b16d, 21193f0f0117cc0f73ccdc9d, d1d28ec78e14318d1295cbd2, 78af4b4162968b041b0b45ca, and da540c3e40664d0d4b5bdea6) exhibit sequential start and end sequences, indicating orderly task execution within the distributed system. The presence of a dedicated parameter server (c87c00f035334f98350072ab and 8fc66c0ae4cc424d0f5ca3e4) suggests a design utilizing parameter server architecture for distributed training or parameter synchronization. The logs reflect typical job lifecycle patterns, with clear demarcation of worker and parameter server tasks, which is essential for fault tolerance and resource management. The timing and coordination of worker start-end pairs imply effective task scheduling, though no explicit failure or delays are observed. Overall, the system demonstrates structured orchestration of distributed workloads, indicative of a well-managed large-scale training environment."
