date_time,record_id,summary
2000-02-14 00:00:00,7077ec572d50395cafcbcb7d,"The logs depict a typical distributed job execution pattern with multiple parallel and sequential task initiations and completions, indicating a dynamic workload with frequent task lifecycle transitions. Several ""ps"" (parameter server) tasks start and end in overlapping timeframes, suggestive of distributed training or coordination processes common in large-scale machine learning workloads. Notably, some jobs involve both ""ps"" and ""worker"" roles, emphasizing the heterogeneity of task responsibilities within the cluster. The presence of workload-specific jobs (e.g., graphlearning) indicates targeted application deployment within the infrastructure. Overall, the system demonstrates complex concurrency, resource utilization, and workload management essential for scalable distributed computing environments."
2000-02-14 06:00:00,7077ec572d50395cafcbcb7d,"The logs indicate multiple parameter servers (ps) starting and ending their tasks asynchronously, demonstrating typical coordination in distributed training jobs. One node with GPU type P100 began its ps task, suggesting GPU-accelerated parameter management. The sequence shows concurrent and sequential ps tasks, reflecting a distributed environment where resources are allocated dynamically. The pattern of starting and ending suggests proper synchronization and job lifecycle management, essential for large-scale training workloads. Overall, the system behavior exemplifies resource utilization and coordination strategies in a cloud-based distributed computing setup."
2000-02-14 12:00:00,7077ec572d50395cafcbcb7d,"The logs indicate multiple parallel ""ps"" (parameter server) tasks starting and ending across various job IDs, reflecting a typical distributed training workload. The tasks exhibit overlapping execution periods, essential for synchronized parameter updates in large-scale distributed machine learning. Some jobs, such as 50ee430267ff52e5da418630 and 3b3aac7fe334dfcff2c3d903, have clearly defined start and end events, highlighting organized task lifecycle management. The pattern suggests a consistent orchestration of parameter server tasks, likely coordinated with worker tasks to ensure training progress. Overall, the system demonstrates typical distributed job execution with concurrent parameter server operations crucial for scalable, fault-tolerant machine learning workloads."
2000-02-14 18:00:00,7077ec572d50395cafcbcb7d,"The logs indicate multiple parallel parameter server (ps) tasks starting and ending across different jobs, reflecting typical distributed training workflows. Several jobs, such as 5469746b09cb0b1a3beeecbd, 66c6938b29678ac56b96476a, and aa27e4a272640237cba03b01, demonstrate concurrent ps instances, indicating scalable distributed job execution. Notably, some jobs involve specific workloads, such as the BERT workload in job 4d203311d23ea6d3038c5a1f, emphasizing diverse task types. The start-and-end patterns suggest typical task lifecycle management for distributed training, with no apparent failures or anomalies. Overall, the logs reflect typical operational behavior for large-scale distributed ML training in a cloud environment."
2000-02-15 00:00:00,7077ec572d50395cafcbcb7d,"The logs indicate multiple parameter server (ps) tasks starting and ending in a possibly overlapping manner, suggesting concurrent management of distributed training jobs. Notably, the task with job ID e4bab29d5e1c7d950e2f0938 involved GPU resources of type P100, implying heterogeneous hardware utilization. The sequence shows some jobs starting before others complete, reflecting dynamic resource scheduling and potential parallel job execution. The pattern of task state transitions highlights typical distributed training workflows, with frequent starts and stops indicating iterative updates or fault tolerance mechanisms. Overall, the system demonstrates active management of distributed tasks across varied GPU types, essential for scalable deep learning workloads."
2000-02-15 06:00:00,7077ec572d50395cafcbcb7d,"The logs indicate a series of parallel 'ps' (parameter server) tasks being started and ended across different jobs, highlighting concurrent resource utilization typical of distributed training workloads. The sequence suggests overlapping execution, which is common in large-scale machine learning tasks where multiple parameter servers operate simultaneously to coordinate model updates. The rapid switching between start and end events reflects an active, dynamic environment with frequent job scheduling and resource management. These patterns highlight the importance of efficient task scheduling and fault tolerance to ensure smooth distributed operations in a large-scale cluster. Overall, the system demonstrates typical distributed control flow, emphasizing the need for robust synchronization mechanisms in large-scale infrastructure."
2000-02-15 12:00:00,7077ec572d50395cafcbcb7d,"The logs indicate multiple parallel job and task executions, primarily involving parameter servers (ps) and m-workers, reflecting typical distributed training workflows. Job and task start/end events suggest coordinated execution and resource management, with some tasks (e.g., ps) completing before others (e.g., m-workers) fully terminate. The sequence demonstrates concurrent task operations, highlighting the importance of synchronization and fault tolerance in large-scale systems. The pattern of resource allocation and job lifecycle management is consistent with cloud-based distributed training workloads. Overall, the logs illustrate typical operational dynamics of distributed jobs with emphasis on task scheduling, execution concurrency, and system robustness."
2000-02-15 18:00:00,7077ec572d50395cafcbcb7d,"The logs indicate multiple parameter server (ps) and worker tasks starting and ending asynchronously, reflecting a typical distributed training workload. The concurrent start and end events suggest coordinated job execution, with ps tasks generally ending after starting, likely after completing their role in parameter synchronization. The sequence shows parallelism in task deployment, which is essential for scaling efficiency in large distributed systems. Overall, the system demonstrates standard Hadoop-like or TensorFlow-style orchestration, emphasizing parallel task management and resource utilization. These patterns are indicative of scalable distributed training or processing jobs in large-scale cloud environments."
2000-02-16 00:00:00,7077ec572d50395cafcbcb7d,"The logs indicate multiple jobs with their parameter servers (ps) and worker tasks starting and ending asynchronously, reflecting a typical distributed training workflow. The task lifecycles show overlapping and sequential executions, suggesting a highly concurrent environment designed for scalable machine learning workloads. The consistent pattern of ps tasks initiating and terminating before or after worker tasks demonstrates coordinated resource management. The dataset likely captures the dynamic scheduling, resource allocation, and task coordination essential for large-scale distributed computations. Overall, the logs exemplify complex, high-throughput orchestration typical of cloud-based distributed machine learning training jobs."
2000-02-16 06:00:00,7077ec572d50395cafcbcb7d,"The logs indicate multiple parallel ""ps"" (parameter server) tasks being initiated and terminated across various jobs, reflecting a typical distributed training workload. Tasks associated with different workloads, such as ""inception,"" ""graphlearn,"" and ""bert,"" show dynamic start-end patterns, suggesting concurrent model training or data processing activities. The frequent job and task overlaps imply high utilization and resource sharing typical of large-scale distributed systems. The presence of workload-specific tasks highlights workload diversity and the need for efficient resource allocation across different training frameworks. Overall, the system demonstrates concurrent execution, workload diversity, and the importance of synchronized task management in large-scale distributed environments."
2000-02-16 12:00:00,7077ec572d50395cafcbcb7d,"The logs indicate multiple parallel and sequential job activities involving parameter servers (ps) and evaluators, with some tasks explicitly marked as started or ended. Several jobs, such as 28d355bf0a15f500f39992c3 and 2ec857affc53c85b7aaa5bd0, show coordinated task progression, highlighting typical distributed workflow management. The involvement of GPU-specific specifications, such as P100, suggests workload scheduling that leverages GPU resources for acceleration. The presence of workload-specific tasks like ""graphlearn"" indicates specialized training or graph processing workloads within the distributed system. Overall, the logs reflect a dynamic scheduling environment with resource allocation for machine learning tasks, emphasizing task lifecycle management and hardware utilization."
2000-02-16 18:00:00,7077ec572d50395cafcbcb7d,"The logs indicate frequent start and end events for parameter server (ps) tasks across multiple jobs, reflecting dynamic resource allocation and workload execution within the distributed system. Several tasks, such as for jobs 08a54b35c167e1c5baf9af56 and 3fcb490c1642a337a7a7ef9e, exhibit sequential completion, suggesting typical task lifecycle management. Workload-specific jobs like 'inception' and 'bert' highlight targeted workload deployment, with distributed tasks coordinated across the cluster. The pattern of interleaved task activities suggests robust job scheduling and resource sharing critical to large-scale training and data processing tasks. Overall, the system displays regular task orchestration essential for efficient distributed computing operations."
2000-02-17 00:00:00,7077ec572d50395cafcbcb7d,"The logs indicate multiple parallel startup and shutdown events of parameter servers (ps) for various jobs, suggesting an active and dynamic distributed training environment. Several jobs (e.g., bea07cecd6d1bc9f81ccefcf, e25f6797c40e66e5095b89ab, 16aa224d6bf84917effe82aa) have their ps tasks frequently starting and ending, reflecting job lifecycle management and resource allocation. The pattern of concurrent task executions highlights the system's capability to handle multi-job workloads with overlapping phases. The repetition of ps start/end cycles indicates iterative training or job resubmission processes typical in large-scale distributed machine learning workflows. Overall, the system demonstrates flexibility and efficiency in managing distributed training tasks at scale."
2000-02-17 06:00:00,7077ec572d50395cafcbcb7d,"The logs indicate frequent start and end events for parameter server (ps) tasks across multiple jobs, reflecting active distributed training workflows. Job coordination appears sequential, with no clear evidence of overlapping ps tasks for the same job, suggesting a structured task execution pattern. The presence of ""evaluator"" tasks, such as in job 33752f1cfca61db2b15e90ac, indicates model evaluation phases integrated within the training pipeline. Some jobs are labeled with specific workloads like ""inception,"" highlighting workload diversity in the system. Overall, the system demonstrates typical distributed training behavior with task lifecycle management, workload variation, and phase demarcation essential for large-scale machine learning tasks."
2000-02-17 12:00:00,7077ec572d50395cafcbcb7d,"The logs indicate frequent start and end events for parameter server (ps) tasks across multiple jobs, reflecting a typical distributed training workflow. Each job appears to involve a pair of ps events, suggesting coordinated resource allocation and deallocation for distributed processing. The consistent pattern of ps task completion across different job IDs points to a stable job scheduling and execution environment. No significant delays or failures are observed in the provided logs, implying reliable task orchestration in the cluster. Overall, the system demonstrates standard distributed job management with parallel task execution and cleanup."
2000-02-17 18:00:00,7077ec572d50395cafcbcb7d,"The logs indicate multiple job and task lifecycle events, primarily focusing on the start and end of parameter servers (ps) across various jobs. Tasks for ps are frequently initiated and terminated, suggesting active management or scaling of distributed components. The pattern of frequent ps startup and shutdown points to dynamic resource provisioning, possibly for fault recovery or workload balancing. No explicit job completion or failure states are noted, implying ongoing or iterative job execution. Overall, the system demonstrates a typical distributed job management pattern with dynamic resource handling in a large-scale environment."
2000-02-18 00:00:00,7077ec572d50395cafcbcb7d,"The logs indicate multiple job and task lifecycle events, involving both parameter servers (ps) and machine workers (MWorker). Several ps tasks have started and ended, suggesting active management of distributed parameters, with overlapping task executions implying concurrent processing. The presence of a workload named ""graphlearn"" associated with a worker task indicates execution of graph-based machine learning workloads. The sequential and concurrent task transitions reflect typical distributed training behavior, emphasizing synchronization points and workload distribution. Overall, the system demonstrates dynamic task management vital for large-scale distributed machine learning workloads."
2000-02-18 06:00:00,7077ec572d50395cafcbcb7d,"The logs indicate the initiation and termination of multiple parameter server (ps) tasks, suggesting a distributed training setup. One worker task has started, linked to a P100 GPU, highlighting GPU utilization in the workload. The sequence shows concurrent start and end events for ps tasks, reflective of typical distributed job coordination. The presence of associated job and task IDs signifies tracking of individual tasks within a larger distributed job. Overall, the system demonstrates standard distributed training operations with coordinated ps and worker tasks across different hardware types."
2000-02-18 12:00:00,7077ec572d50395cafcbcb7d,"The logs indicate that the parameter server (ps) associated with the workload ""graphlearn"" for job 5e6e1dbf468dcf0bf393535a has started and subsequently ended, suggesting completion or termination of that task. The start and end events are sequential, providing insight into task lifecycle and resource allocation. This behavior highlights typical coordination in distributed training workloads, where ps nodes initialize and then gracefully shut down upon job completion. The dataset demonstrates job orchestration involving distinct task phases, crucial for understanding resource utilization and fault tolerance in large-scale distributed systems. Overall, the logs reflect the expected operational behavior of a distributed training job within a cluster environment."
2000-02-18 18:00:00,7077ec572d50395cafcbcb7d,"The logs indicate a typical distributed training process involving multiple parameter server (ps) tasks starting and ending asynchronously, suggesting parallelized workload management. The sequence demonstrates the initiation and completion of tasks for different jobs, reflecting the system's capacity to handle concurrent job execution. The overlapping start and end times imply efficient resource utilization and workload scheduling within the cluster. These patterns are consistent with large-scale distributed training workflows, emphasizing the importance of synchronized coordination among tasks. Overall, the system demonstrates a robust handling of parallel task execution critical for scalable distributed computing."
2000-02-19 00:00:00,7077ec572d50395cafcbcb7d,"The logs indicate the execution and completion of parameter server (ps) tasks across multiple jobs, with several jobs initiating and ending ps tasks in quick succession, suggesting workload distribution and task orchestration. Some jobs, such as the workload labeled ""graphlearn,"" display parallel ps task executions, indicating simultaneous training operations. The presence of multiple jobs with overlapping ps activities demonstrates concurrent task management typical in large-scale distributed training environments. The consistent start-end pattern for ps tasks reflects organized job lifecycle management, essential for resource allocation and fault tolerance. Overall, these logs exemplify typical behavior in distributed machine learning workflows, emphasizing parallelism, workload diversity, and task coordination."
2000-02-19 06:00:00,7077ec572d50395cafcbcb7d,"The logs indicate dynamic task management with multiple parameter servers (ps) and worker nodes starting and ending in a non-linear sequence, reflecting typical distributed training workflows. Several workload-specific jobs, such as ""graphlearn"" and ""inception,"" show coordinated start and end points for their parameter servers, suggesting a structured deployment of different training processes. The presence of concurrent ps and worker job completions implies effective resource utilization and parallel execution across distributed nodes. The sequence demonstrates typical cluster behavior, with ps nodes initiating and terminating in coordination with worker tasks, highlighting system resilience and task scheduling efficiency. Overall, the logs exemplify key aspects of distributed job orchestration and resource management in a cloud environment."
2000-02-19 12:00:00,7077ec572d50395cafcbcb7d,"The logs indicate multiple parameter server (ps) tasks are starting and ending across different jobs, suggesting parallel initialization and coordination phases in the distributed system. The sequential start and end patterns reflect typical task lifecycle management, vital for synchronization in large-scale distributed training or computation workloads. The presence of multiple jobs with overlapping ps activity points to concurrent job execution within the cluster infrastructure. These behavior patterns highlight the importance of efficient scheduling and resource allocation to minimize job startup latency. Overall, the logs demonstrate a managed orchestration of ps tasks critical for maintaining distributed training consistency and performance."
2000-02-19 18:00:00,7077ec572d50395cafcbcb7d,"The logs indicate a series of parallel processing tasks involving multiple jobs, with most tasks transitioning from start to end without significant delays, suggesting efficient job scheduling. The presence of GPU-specific tasks, such as the one with GPU type P100, highlights workload heterogeneity and resource specialization within the cluster. Job durations appear consistent, implying stable resource availability and effective job management. The frequent task restarts and completions point to a workload characterized by iterative or distributed data processing typical in large-scale ML training or data analysis workflows. Overall, the cluster demonstrates typical distributed system behavior with concurrent task execution and resource utilization tailored to specific hardware needs."
2000-02-20 00:00:00,7077ec572d50395cafcbcb7d,"The logs indicate a typical pattern of multiple Parameter Server (ps) tasks starting and ending asynchronously, reflecting active coordination and communication for distributed training jobs. Several jobs, such as those with IDs 3c8a3ece27e..., 9e7caed19c..., and f2ad9115378..., show overlapping lifecycles, demonstrating concurrent job execution and resource sharing. The presence of a GPU-specific task associated with a P100 GPU underscores heterogeneous hardware utilization within the cluster. The systematic start and end of ps tasks suggest orchestrated synchronization points crucial for distributed parameter updates. Overall, the data reflects a dynamic, multi-job environment with asynchronous task management and heterogeneous compute resource deployment."
2000-02-20 06:00:00,7077ec572d50395cafcbcb7d,"The logs indicate multiple parallel training jobs utilizing parameter servers (ps) and evaluators, with some tasks starting and ending concurrently, suggesting a distributed training setup. The presence of different GPU types (e.g., P100) implies heterogeneous hardware utilization within the cluster. The consistent start-end patterns for ps tasks imply active job coordination and resource management. The evaluator tasks show brief execution periods, indicating regular evaluation checkpoints during training. Overall, the system demonstrates typical distributed training workflows with multiple task roles and hardware diversity."
2000-02-20 12:00:00,7077ec572d50395cafcbcb7d,"The logs indicate frequent start and end events for parameter server (ps) tasks, reflecting typical workload distribution and synchronization activities in a large-scale distributed system. Job execution appears to be dynamic, with multiple jobs initiating ps tasks concurrently, suggesting workload multiplexing across shared resources. Certain jobs, such as workload ""graphlearn,"" are explicitly identified, highlighting the system's capability to handle specialized tasks. The consistent pattern of task start/end sequences demonstrates coordinated task management and resource allocation. Overall, the system exhibits typical distributed computing behavior, with multiple tasks executing concurrently and completing in a timely manner."
2000-02-20 18:00:00,7077ec572d50395cafcbcb7d,"The logs indicate multiple parallel ""ps"" (parameter server) tasks being started and ended across various jobs, suggesting a distributed training or parameter management process. The overlapping start and end times imply concurrent task execution, which is typical in large-scale distributed systems to maximize resource utilization. The sequence of task completions demonstrates a dynamic workload with multiple jobs processing simultaneously, indicating a high-throughput environment. The absence of errors or failures in the logs suggests stable job execution and effective coordination among distributed components. Overall, the system exhibits concurrent task management characteristic of scalable, distributed computing infrastructure used for training large models or processing significant datasets."
2000-02-21 00:00:00,7077ec572d50395cafcbcb7d,"The logs indicate multiple parallel 'ps' (parameter server) tasks starting and ending across different jobs, reflecting concurrent distributed training operations. Some jobs, such as the one with workload labeled ""graphlearn,"" are actively engaged in 'ps' tasks, suggesting ongoing model parameter synchronization. The pattern of frequent task starts and ends suggests dynamic resource allocation and high parallelism typical in large-scale distributed training environments. The temporal sequence shows overlapping job executions, implying efficient scheduling and utilization of cluster resources. Overall, the system demonstrates robust support for concurrent distributed workloads with coordinated parameter management."
2000-02-21 06:00:00,7077ec572d50395cafcbcb7d,"The logs indicate frequent starting and ending of parameter server (ps) tasks across multiple jobs, suggesting dynamic resource allocation and load balancing. Several jobs show overlapping lifecycles, reflecting concurrent task execution typical in distributed training environments. The rapid succession of start and end events for the same tasks implies efficient job scheduling and possible rescheduling to optimize resource utilization. The pattern of task activity suggests a fluctuating workload, highlighting the need for elastic scalability and robust fault tolerance mechanisms. Overall, the system demonstrates typical distributed computing behavior with high concurrency and dynamic management of core components."
2000-02-21 12:00:00,7077ec572d50395cafcbcb7d,"The logs indicate multiple start and end events for parameter server (ps) and evaluator tasks, demonstrating typical distributed training coordination. Notably, some ps tasks (e.g., 3952400cc7978790475579e5 and 95f377031240396379f605ec) exhibit rapid start-end sequences, suggesting quick resource allocation or task completion. The evaluator task (7dbca0ffa139eadd6767177e) runs sequentially after its corresponding start, reflecting synchronized task management. The overall pattern shows a mixed workload with concurrent ps and evaluator tasks, pointing to a scalable distributed training environment. These logs facilitate analysis of task lifecycle, resource utilization, and potential bottlenecks in distributed job execution."
2000-02-21 18:00:00,7077ec572d50395cafcbcb7d,"The logs indicate frequent startup and termination of parameter servers (ps) across multiple jobs, suggesting dynamic resource allocation and task scheduling. Several jobs (c24956d6a5b85811c82b555b, 3aeb0d01501c7039bf920fff) exhibit quick transitions from ps start to end, implying short-lived or iterative tasks. The presence of concurrent ps processes hints at layered or multi-stage training workflows within the distributed system. These activities highlight a workload pattern characterized by rapid job churn, which may impact resource utilization and scheduling efficiency. Overall, the system demonstrates active management of distributed training jobs with a focus on flexible, short-duration task execution."
