date_time,record_id,summary
2022-05-22 06:00:00,AUS_LAB,The article does not specifically mention labor unions.
2022-05-31 04:30:00,AUS_LAB,"The article highlights Queensland's long history of left-wing radicalism, including the significant influence of labor unions such as the Australian Workers Union (AWU), which was involved in major strikes like the 1964 Mt Isa Mines strike led by anarchist Pat Mackie. It describes the close relationship between Indigenous activists and white unionists, with organizations like the Cairns Aboriginal and Torres Strait Islander Advancement League and the Waterside Workers Federation playing crucial roles in advocating for Indigenous rights and workers' conditions. Historically, these unions and activist groups were intertwined with broader radical movements, challenging authority and advocating for social justice. The legacy of these struggles continues to influence contemporary political campaigns, including those by the Queensland Greens, emphasizing material issues and anti-establishment sentiments rooted in union activism."
2022-06-02 21:00:00,AUS_LAB,"The article highlights historical and ongoing issues of forced and underpaid labor involving Pacific Islander workers in Queensland, drawing parallels to slavery and indenture practices. It discusses the exploitation of Pacific women like Nie, who faced coercion and lacked genuine consent in plantation and domestic labor, reflecting broader systemic abuse and labor rights violations. Contemporary Pacific Islander seasonal workers continue to protest poor conditions and wage theft, with allegations of modern slavery and “blackbirding”-like practices. Legal cases such as Nie’s court testimony reveal struggles over worker autonomy and rights within a colonial and legal framework that limited workers' ability to freely consent. These historical and current labor struggles emphasize the importance of unionization and advocacy for fair treatment, labor rights, and protections for vulnerable workers."
2022-07-08 06:15:00,AUS_LAB,"The article discusses the looming strike by Qantas engineers, who are preparing to vote on strike actions such as overtime bans and 12-hour stoppages due to failed pay rise negotiations with the trade union Australian Licensed Aircraft Engineers’ Association (ALAEA). The union criticizes Qantas for not providing adequate wage increases over the past four years, despite pandemic challenges, and has rejected the airline’s one-off bonus offer as insufficient. The dispute highlights ongoing labor tensions within the airline industry regarding fair compensation and working conditions. The stalemate underscores the broader issues faced by unions in negotiating with large corporations during challenging economic recovery periods."
2022-07-11 02:30:00,AUS_LAB,"The article mentions the Health and Community Services Union (HCSU), which reported a shortage of 3,000 qualified mental health workers and highlighted the employment gap in Victoria’s mental health sector. The HCSU has not provided comments prior to the deadline, indicating its potential concern or engagement with workforce shortages. The Victorian Government has allocated significant funding, including $372 million in the 2022-23 budget, to expand the mental health workforce with over 1,400 additional professionals and a total investment of more than $600 million since the Royal Commission’s reports. The union’s focus on staffing shortages underscores its interest in advocating for worker recruitment, training, and better work conditions within the mental health sector. However, specific union actions or negotiations are not detailed in the article."
2022-07-18 01:15:00,AUS_LAB,"The Australian Manufacturing Workers’ Union (AMWU) is involved in a dispute at Lactalis Echuca following the termination of a long-time worker, believed to be retaliatory for her union activities. The union claims the worker was unfairly dismissed without proper documentation and is advocating for her reinstatement, citing violations of the enterprise bargaining agreement (EBA). AMWU members and staff commenced a multi-day strike protesting the dismissal and alleged union-busting tactics, including internal company plans to confront union delegates. The dispute intensified after a leaked internal email suggested Lactalis aimed to weaken union influence and change management practices. The strike concluded after the Fair Work Commission expedited a hearing concerning the worker’s unfair dismissal."
2022-07-20 10:30:00,AUS_LAB,Shell plans to lock out workers at its Prelude floating LNG vessel starting Monday unless they cease their strike actions. The workers have been engaging in industrial actions such as work bans and one-hour stoppages. The company announced that workers participating in the strike will not receive pay during the lockout period beginning July 25. This escalation marks a significant development in the ongoing industrial dispute. The dispute involves issues related to labor actions and employment conditions at the facility.
2022-07-22 17:00:00,AUS_LAB,"Workers at Shell's Prelude FLNG facility have been engaged in a prolonged industrial dispute over wages and job security, leading to protected industrial actions such as stoppages and work bans. In response, Shell has resorted to a lockout, ceasing payments and demobilizing non-essential staff after 19 months of negotiations failure. The industrial action has caused a halt in production and disrupted LNG loading operations. The Australian Workers Union has warned that Shell’s lockout could jeopardize the facility’s operations and regulatory compliance. This ongoing labor dispute highlights significant tensions between workers’ demands and Shell’s management strategies."
2022-07-26 10:45:00,AUS_LAB,"The Australian Workers Union has extended a protected strike at Shell’s Prelude offshore gas facility, demanding higher salaries from workers onboard. Shell has responded by temporarily calling off a planned lockout, citing safety concerns but the union dismisses these claims as a “red herring.” The union states that it has raised safety issues with regulators for over a year and would cease protected actions if safety was jeopardized. Shell has refused to meet with union representatives during the strike, leading to accusations of stonewalling and escalation by the union. The National Offshore Petroleum Safety and Environmental Management Authority is scheduled to inspect Shell’s headquarters as part of ongoing safety investigations."
2022-08-02 04:45:00,AUS_LAB,"The article highlights support from workers, professionals, and students for Dr. David Berger, a physician advocating for zero-COVID policies, against censorship and threats from authorities. It emphasizes the broader struggle against governmental and corporate actions perceived as suppressing free speech and democratic rights, including the targeting of Julian Assange. The support messages criticize the capitalist-driven pandemic policies and call for workers to unite against the influence of oligarchs and promote socialist alternatives. The article discusses the ongoing efforts to defend Dr. Berger and others from censorship and political repression, framing these actions within a larger fight for workers' rights and freedoms. Overall, it underscores the importance of unionized and collective action to oppose government overreach and protect democratic and labor rights."
2022-08-05 03:30:00,AUS_LAB,"The article details how Western Mine Workers Alliance (WMWA), a coalition of trade unions including the Construction, Forestry, Mining and Energy Union and the Australian Workers Union, has criticized workplace safety conditions in Western Australia's mining sector. Despite multiple worker fatalities and serious injuries, unions have largely made pleas to mining executives for improved safety, rather than organizing industrial actions. They reported reductions in safety personnel and increased management discouragement of safety concerns following recent restructures. The unions have not initiated strikes or significant protests in response to ongoing safety issues, instead focusing on negotiations. The article advocates for independent rank-and-file committees and a socialist transformation of the industry to ensure workplace safety and social ownership."
2022-08-12 09:00:00,AUS_LAB,"The retail union, Distributive and Allied Employees Association, filed a Federal Court claim against McDonald's and its operators, alleging the denial of paid rest breaks to over 250,000 workers across nearly 1,000 sites. The union accuses McDonald's of violating employment rights by failing to provide mandated rest periods. McDonald's has argued that the union itself previously accepted this long-standing practice. The legal action seeks to address alleged employment rights violations related to rest breaks. This case underscores ongoing disputes between labor unions and major corporations over workers' rights and conditions."
2022-08-14 08:45:00,AUS_LAB,"The Australian Council of Trade Unions (ACTU) president, Michele O’Neil, expressed support for permanent migration but opposed short-term visas, criticizing their use as a quick fix for structural issues like low pay and insecure work. She emphasized that many skill shortages are due to a lack of fair-paying jobs rather than a lack of skills, and called for more focus on skills development within Australia. Unions advocate for tackling systemic employment conditions and ensuring that migration policies benefit workers locally. The union's stance aligns with concerns over employer reliance on visa workers instead of investing in domestic workforce training. Overall, unions advocate for balanced migration policies that prioritize fair employment conditions and skills development for Australian workers."
2022-08-15 10:45:00,AUS_LAB,"A union has criticized the Business Council of Australia's initiative to add Sydney’s Aerotropolis and Victoria’s Fishermans Bend to a list allowing employers to sponsor skilled overseas workers through Designated Area Migration Agreements (DAMAs). The union's opposition stems from concerns about the potential impact on local employment opportunities and wages. DAMAs are formal agreements between the federal government and regional authorities, offering increased access to overseas workers beyond standard migration programs. The union objects to the expansion of these agreements in the specified areas. Overall, the union advocates for protecting local jobs and ensuring fair employment practices."
2022-08-16 05:30:00,AUS_LAB,"The Electrical Trades Union, through acting national secretary Michael Wright, opposes the Business Council of Australia's proposal to include Sydney’s Aerotropolis and Melbourne’s Fishermens Bend in a designated area migration agreement (DAMA). Wright argues that these areas are not experiencing significant skill shortages and emphasizes the importance of training young tradespeople for major infrastructure projects instead of importing migrants. The union's stance reflects its focus on protecting local workers' employment opportunities and promoting skills development. The BCA's proposal aims to facilitate easier access to overseas workers for certain regional projects. Overall, the union's position is to prioritize domestic workforce training over reliance on migrant labor for infrastructure development."
2022-08-16 05:45:00,AUS_LAB,"The article criticizes the Construction Forestry Maritime Mining and Energy Union (CFMMEU) for not addressing safety issues in the construction industry, despite multiple incidents resulting in fatalities and injuries. It highlights the union's role in seemingly enforcing unsafe working conditions and failing to advocate for workers' safety. The article also mentions that SafeWork NSW conducted inspections related to fall risks, with limited enforcement and ongoing investigations, suggesting a lack of accountability. It argues that workplace safety problems persist because unions and government safety bodies prioritize corporate profits over worker safety. Overall, the article portrays unions as complicit in maintaining hazardous work environments and calls for increased worker oversight and safety advocacy."
2022-08-18 07:30:00,AUS_LAB,"The Australian Workers’ Union (AWU) is campaigning for Pacific Australia Labour Mobility (PALM) scheme workers to receive a minimum post-deduction payment of $250 weekly, ensuring fair wages and financial certainty. The union emphasizes that any outstanding deductions should be carried forward until workers earn enough to cover them. Major employers like MADEC and the Approved Employers in Australia support a safety net for workers’ income after deductions. The proposed minimum wage safety net aims to provide stability, especially during low-income weeks caused by weather or other factors. The union's proposal is broadly supported by employers and could be an effective policy to improve labor standards for seasonal workers."
2022-08-22 20:45:00,AUS_LAB,"The article discusses efforts by labor unions, including RAFFWU and the Australian Services Union (ASU), to organize and represent Apple retail store employees in Australia through meetings and industrial actions. RAFFWU is hosting an all-Apple-worker Zoom call to guide employees on unionization, industrial action, and bargaining processes, highlighting their successful actions in securing improved working conditions in the past. In the United States, several Apple stores, including locations in Maryland, Kentucky, and New York, are involved in unionization efforts, with some filing paperwork or gathering signatures to form unions. These activities reflect a broader movement among Apple retail employees seeking increased bargaining power and better conditions."
2022-08-24 00:45:00,AUS_LAB,"Apple retail employees in the United States have been engaging in unionization efforts, with stores in Cumberland Mall (Atlanta), Towson Mall (Maryland), Oxmoore Center Mall (Louisville), and employees at Grand Central Terminal (New York City) reportedly forming or gathering signatures for unions. Apple management attempted to discourage unionization by hosting FAQ-style meetings to address employee questions. Additionally, in Australia, RAFFWU is hosting a Zoom call to discuss the potential unionization of Apple retail employees. These actions indicate a growing movement among Apple retail workers seeking union representation."
2022-08-24 13:15:00,AUS_LAB,"The Australian Workers’ Union National Secretary Daniel Walton expressed opposition to the National Farmers Union’s proposal to consider non-monetary benefits in workplace negotiations, viewing it as a concerning development for workers. Walton emphasized that workers currently need fair pay raises, especially in industries like fruit and vegetable farming, where efforts are underway to secure minimum wages. He found the proposal strange, as it suggests workers should feel privileged for their jobs, which he disputes. Walton hoped there might have been misrepresentation in the report. Overall, the article highlights a labor union stance opposing changes to how employee benefits are negotiated, emphasizing the importance of wage increases."
2022-08-24 15:00:00,AUS_LAB,"The article reports that Australian unions, including the Australian Services Union (ASU) and the Shop Distributive and Allied Employees Association (SDA), are protesting against Apple’s alleged breach of good faith bargaining principles during wage negotiations with its 4,000 staff in Australia. The unions accuse Apple of obstructing union communication with workers and rejecting a request to extend the consultation deadline, leading to their intention to seek legal orders from the Fair Work Commission. Additionally, RAFFWU, another union, is organizing a Zoom meeting to discuss unionization and industrial action among Apple retail employees, highlighting ongoing union efforts to improve working conditions and wages. The unions are actively involved in negotiations and industrial actions to ensure worker rights are protected."
2022-08-26 22:15:00,AUS_LAB,"The article discusses the Australian Greens' advocacy for stronger worker protections, wage increases, and social reforms, highlighting their push for amendments to the Fair Work Act to raise wages and improve conditions—particularly in women-dominated industries and the care economy. Greens leaders Adam Bandt and Senator Barbara Pocock emphasize the need for immediate wage growth and social security measures, criticizing the government's focus on skills reform over wage supports. The Greens advocate for policies like setting the minimum wage at 60% of median wages, faster wage growth in care sectors, and funding for childcare, health, and housing to improve living standards. They warn that summit outcomes may fail without Greens support and oppose reliance solely on market forces and delayed reforms. Overall, the article portrays the Greens as a key political force championing labor rights and social justice, positioning themselves against the current government's approach."
2022-08-29 03:30:00,AUS_LAB,"The article discusses the role of unions in the economy, suggesting that they focus on restricting sectors rather than promoting bold reforms. It highlights Australia's historical economic growth and reform efforts but does not explicitly detail union activities. The emphasis is on the unions' interest in limiting economic sectors rather than advocating for innovative solutions. Overall, the article implies that unions may prioritize preserving existing interests over pushing for comprehensive reforms."
2022-08-31 18:00:00,AUS_LAB,"The Australian Workers Union (AWU) national secretary, Daniel Walton, highlighted ongoing issues of exploitation and wage theft within the horticulture industry, indicating that these problems are deeply rooted and not easily resolved. Walton criticized some contractors for dubious practices while emphasizing that there are no laws preventing farmers from directly hiring workers, suggesting that direct employment could mitigate some issues. The union's stance underscores concerns over unfair labor practices and advocates for better regulation and enforcement to protect workers’ rights. Despite the recent minimum wage increase for harvest workers, the union believes that systemic exploitation persists. Overall, the union advocates for direct hiring and stronger oversight to improve working conditions and wages in the horticulture sector."
2022-09-01 22:00:00,AUS_LAB,"The Australian Workers' Union (AWU) will represent its members at the upcoming Jobs and Skills Summit, advocating for policies on migration, skills development, and fair work conditions. The AWU emphasizes the need for a union-backed compact to ensure migrants contribute to Australian workforce training and seeks to connect new migrants with unions to prevent exploitation. It advocates for legalizing ""same work, same pay"" principles to address wage disparity and labour hire issues, alongside a fairer collective bargaining system that includes multi-employer and sector bargaining. Additionally, the AWU promotes the development of Australia's steel and hydrogen industries, highlighting the creation of skilled jobs and the importance of a sustainable manufacturing future. The union aims to influence industrial relations reforms that improve working conditions and secure long-term employment opportunities for Australian workers."
2022-09-02 23:30:00,AUS_LAB,"The article discusses the Australian Labor government's initiatives to increase permanent migration and address skills shortages, involving industry leaders, unions, and government ministers. Prime Minister Albanese emphasized giving workers a sense of ownership and reducing reliance on temporary labor by offering more permanent residency opportunities for various sectors. The summit included union representatives, although opposition leader Dutton criticized their declining influence, representing less than 14% of the workforce. Dutton expressed concern that decisions favor union interests over workers' wellbeing amid rising living costs. Overall, the article highlights the government's collaboration with unions to shape migration and labor policies, with ongoing political debates about union influence."
2022-09-03 11:30:00,AUS_LAB,"The article discusses tensions between rival construction unions, specifically the CFMEU and the Australian Workers' Union (AWU), amid disputes over union influence and redundancy issues. The CFMEU has been accused of pressuring workers and firms to align with their interests, while the AWU has taken legal action against global companies over redundancies. Increased tensions between these unions are noted prior to the brawl at the North East Link building site. The altercation is linked to broader union rivalry and conflicts within the construction industry. The incident highlights ongoing issues of union influence, violence, and safety concerns in the sector."
2022-09-06 16:45:00,AUS_LAB,"The article details the case of Annunziata 'Tina' Cinque, a former Jetstar employee, who was terminated for refusing to comply with the airline's COVID-19 vaccination policy. She claimed she was coerced into attending a vaccination appointment and was pressured to sign documents indicating her unwillingness to vaccinate, which was found to be a deliberate act to record her as unvaccinated. The Fair Work Commission ruled that her dismissal was lawful and justified due to her actions and the airline's vaccination mandate, which was deemed lawful and reasonable. The case highlights issues related to employee rights and employer mandates in the context of workplace health and safety. Overall, while the article touches on employer-employee relations and workplace policies, it does not specifically address a labor union's involvement or actions."
2022-09-19 02:30:00,AUS_LAB,"The article discusses Australian trade unions representing white-collar workers at banks and universities, advocating for formal agreements to prevent responses to emails outside of working hours and seeking pay raises. It highlights the influence of the ""quiet quitting"" phenomenon, where employees do only the bare minimum, partly driven by a labor shortage giving workers more bargaining power. The article also notes that increased labor demand has led more workers to consider leaving traditional employment altogether and start their own businesses. Despite economic shifts, the issue remains rooted in employee engagement and work-life balance, which unions aim to address. Overall, the piece underscores evolving labor dynamics, with unions seeking to improve workers' conditions and challenge expectations about overwork."
2022-09-19 08:45:00,AUS_LAB,"The article discusses Australian trade unions representing white-collar workers at banks and universities advocating for boundaries around after-hours work, including no response to emails outside regular hours and a pay rise request. It highlights the phenomenon of ""quiet quitting,"" where employees do the bare minimum, partly due to job dissatisfaction and increased labor market power from high job vacancies. The focus on labor conditions and employment practices reflects ongoing concerns about worker rights, work-life balance, and job fulfillment. The rise of self-employment and small businesses is also noted as a response to workplace dissatisfaction and the desire for more control over work. Overall, the article underscores evolving worker sentiments and union efforts to improve labor conditions amid tight labor markets."
2022-09-21 12:30:00,AUS_LAB,"The article highlights concerns from bus union representatives, Tom Brown and Peter Allen, regarding escalating violence on Brisbane's bus routes, especially route 100. Union representatives describe drivers' fear and frustration due to frequent violent incidents, which they say have become common on certain suburban routes. There is a dispute between political entities—Brisbane City Council and the state government—over responsibility for improving bus safety. Labor councillor Jared Cassidy has called for accountability, emphasizing that bus drivers are unsafe while working. Overall, the article sheds light on labor union concerns about safety and violence faced by bus drivers, and the ongoing political debate over responsibility."
2022-09-21 14:30:00,AUS_LAB,"Unions in Australia have taken Apple to the Fair Work Commission to demand better pay and guaranteed weekends for employees. Workers are advocating for at least one weekend off per month and consecutive days off for those working weekends. The unions also oppose the proposed agreement that classifies permanent part-time staff as casuals, with less predictable rosters. Apple has agreed to return to negotiations and will hold meetings with unions twice weekly, delaying any voting or strikes until after October 11. The dispute highlights ongoing union efforts to improve working conditions and pay for Apple employees."
