date_time,record_id,summary
2024-02-09 08:15:00,AUS_LAB,"The Australian Workers' Union (AWU) NSW branch secretary Tony Callinan stated that the closure of the Newcastle steel mill, a historically unionized site, dealt a significant blow to the region's identity and highlighted concerns about Australia's reliance on imported steel, raising long-term sovereignty issues. He emphasized that the mill was a strong union site with members who upheld union values through decades of struggle, and that the site's closure marked the end of an era for unionized steel work in Newcastle. Callinan noted that while many workers received severance packages or transitioned to new careers, the closure represented a loss of skills and a threat to local job security. The union praised the company's handling of the closure, acknowledging some workers' good severance packages and efforts to facilitate alternative employment. Overall, the article depicts the closure as a significant event affecting union members and the local steel industry heritage."
2024-02-09 10:15:00,AUS_LAB,"The Australian Workers' Union (AWU) NSW branch secretary Tony Callinan expressed sadness over the closure of the Molycop steel mill in Newcastle, emphasizing its significance to workers and the community. He highlighted that many long-term workers have lost their jobs, some of whom have never experienced employment elsewhere, raising concerns about job security and local skills erosion. Callinan noted that the shutdown dealt a blow to Newcastle's identity as a 'steel city' and raised national issues regarding Australia's reliance on imported steel, which could impact the country's sovereignty and capacity in future crises. Despite the closure, the union acknowledged that the company provided severance packages and facilitated transition efforts, but still considered the loss a significant blow to union-held values and regional industry."
2024-02-13 03:30:00,AUS_LAB,"The article does not directly address labor unions but highlights issues related to workforce wellbeing, trust, and employee-employer relations in Australia. It emphasizes the need for empathetic leadership and better work-life balance, which can influence union activities focused on improving working conditions. The survey findings suggest employees desire more flexible work arrangements and better treatment, areas traditionally advocated for by labor unions. Growing stress and burnout due to aggressive performance goals may also fuel union efforts to advocate for healthier workplace standards. Overall, the report underscores the importance of employee representation and support, aligning with union objectives."
2024-02-14 01:30:00,AUS_LAB,"The article discusses the Australian government's passage of the ""right to disconnect"" law, aimed at protecting workers from being contacted outside of work hours without penalty. Australian unions welcomed this reform, highlighting its potential to prevent workers from performing 280 hours of unpaid work annually. The law addresses concerns about the encroachment of out-of-hours communications and promotes work-life balance. Opponents, including business groups, raise issues about economic impacts and technological flexibility. Overall, the union perspective is supportive of policies that safeguard workers' rights to disconnect and reduce unpaid labor."
2024-02-15 07:00:00,AUS_LAB,"The Construction, Forestry, Maritime, and Electrical Employees Union (CFMEU) organized a protest in Queensland, with around 6,500 workers marching to demand improved workplace safety measures following a colleague's death due to heat stroke. The union called for the implementation of a heat stress code of practice for outdoor and high-risk site workers. CFMEU officials criticized the government and the industrial relations minister for inadequate safety oversight and planned to present resolutions demanding accountability and safety reforms to Premier Steven Miles. The protest was sparked by the death of Daniel Sa'u, whose family called for urgent safety actions. The union emphasized the need for leadership and regulatory changes to prevent future tragedies."
2024-02-19 05:15:00,AUS_LAB,"The article discusses proposed Australian legislation, the Fair Work Amendment (Right to Disconnect) Bill 2023, which aims to limit employer contact outside of working hours, potentially impacting labor relations. It highlights concerns that the law's vague language and broad scope could undermine normal workplace practices and hinder employer-employee relations. Critics argue that such legislation might be harmful to business operations and contradicts the existing ethical and respectful workplace culture. The opposition suggests that the bill could be repealed if they regain power, reflecting political opposition to increased regulation. Overall, the article touches on issues of work ethics, employer-employee trust, and the regulation of workplace boundaries, which are relevant to labor union interests."
2024-02-20 02:30:00,AUS_LAB,"The article does not mention any labor unions or labor-related activities. It primarily describes the demolition of the Port Kembla Copper stack and public reactions to it, with no reference to worker organization, union actions, or labor rights. Therefore, it is not relevant to labor unions."
2024-02-21 01:00:00,AUS_LAB,"The Australian Workers Union (AWU) represents some of the workers affected by Bega Group's factory closure in Burnie and is expressing concern over the decision, describing it as “devastating” for the local community. The union prefers Bega to upgrade their infrastructure rather than shut down the factory entirely. The AWU held talks with other dairy companies, Saputo and Fonterra, to explore employment opportunities for displaced workers, with negotiations still ongoing. The union criticized the closure for disrupting longstanding community ties and emphasized their role in advocating for workers' interests. Overall, the AWU is actively involved in seeking alternative employment solutions for the affected employees."
2024-02-21 04:30:00,AUS_LAB,"The article discusses the impact of non-compete clauses on Australian workers, highlighting that these clauses can restrict employees' ability to switch jobs or start their own businesses, potentially affecting wages and productivity. While the article does not directly address labor unions, the use of such clauses raises concerns about workers' rights and bargaining power. Larger businesses are more likely to include non-compete clauses, especially in finance, insurance, and real estate sectors. Labor unions may advocate for reforms to limit or regulate these clauses to protect workers' employment mobility and income potential. Overall, the issue underscores ongoing debates about workers' rights and employer practices in the workplace."
2024-02-26 11:15:00,AUS_LAB,"The article highlights the growing tension between employees and employers over return-to-office mandates in Australia, with many workers expecting flexible work arrangements. It underscores the importance of communication and negotiation in maintaining employee satisfaction and retention, as workers seek work-life balance and hybrid work options. Labor unions could potentially advocate for workers' rights to flexible working conditions amid this shift, emphasizing the need for clear policies and fair treatment. As companies compete for talent, unions might leverage this moment to negotiate better remote work policies and protections for workers' preferences. Overall, the changing workplace dynamics could influence union activities related to workplace flexibility and employee wellbeing."
2024-03-01 01:30:00,AUS_LAB,"The article mentions the Australian Workers Union (AWU) through Steve Ackerman, who reports that workers were present during the sinkhole incident at the M6 tunnel construction site. The union's representative indicated that construction work was halted and workers were moved away for safety reasons. There is no specific detail about labor disputes or union actions related to the sinkhole event, but the presence of a union representative highlights union involvement in worker safety and site management. The situation underscores the importance of union oversight in construction safety and emergency response. No further details connect the union to broader labor issues beyond site safety measures during the incident."
2024-03-05 01:15:00,AUS_LAB,"The Australian Workers' Union (AWU) intervened in a dispute involving an underpaid worker at Secure Energy, resulting in the worker receiving nearly $30,000 in back pay. The union helped resolve issues related to underpayment of wages and the backdating of the worker’s termination. AWU advocates for worker rights, emphasizing the importance of union membership to ensure fair treatment and full entitlements. Ronnie Hayden, the AWU Victorian branch secretary, highlighted the union's role in backing members and promoting awareness of labor rights. Overall, the AWU supports workers with better pay, conditions, and legal assistance, and union members earn significantly more than non-union workers."
2024-03-06 05:15:00,AUS_LAB,"A construction union, the Construction, Forestry, Maritime, Mining and Energy Union (CFMEU), faced disciplinary action when one of its representatives, Anthony Dimitriou, was suspended from entering work sites for three months by the Fair Work Commission. The suspension followed a 2018 incident where Dimitriou refused to undergo a site induction and entered a work site unaccompanied, breaching safety protocols. The court found Dimitriou guilty of obstructing delivery trucks and deliberately ignoring safety procedures, including refusing an induction despite prior warnings. The commission’s decision emphasized that the suspension was protective and corrective, rather than punitive, considering Dimitriou’s role in worker safety and the circumstances of his conduct. This case highlights union accountability and adherence to workplace safety laws within the construction industry."
2024-03-13 21:15:00,AUS_LAB,"The Australian Workers Union Victoria state secretary Ronnie Hayden expressed concern that safety issues raised by workers at the Ballarat mine had been ignored, highlighting the union's role in advocating for mine safety. He criticized the use of unsupported ground and air legging for mining, indicating safety violations that the union likely opposed. The union's spokesperson emphasized the importance of prioritizing worker safety and addressing hazardous working conditions. The incident has prompted calls for investigations to understand safety lapses, reflecting the union’s ongoing efforts to improve mine safety standards. The union's involvement underscores the importance of collective worker advocacy in addressing workplace safety concerns in the mining industry."
2024-03-13 21:45:00,AUS_LAB,"The Australian Workers' Union Victoria state secretary Ronnie Hayden expressed that the tragic mine collapse could have been prevented and criticized the use of unsafe mining techniques, specifically ""air legging."" The union intends to push for the enforcement of Victoria's industrial manslaughter laws in response to the incident. Union representatives and organizers have raised concerns about the safety of certain mining practices, which they claim have been ignored. Twenty-nine other workers at the mine were evacuated safely, highlighting the union's focus on workplace safety. The union's stance underscores their advocacy for safer working conditions and accountability in the mining industry."
2024-03-13 23:15:00,AUS_LAB,"The Australian Workers Union Victoria expressed concern about safety issues at the Ballarat Gold Mine, claiming workers had flagged safety problems that were ignored. Union officials highlighted that workers involved in unsafe manual mining practices, such as air legging, were working on unsupported ground, which contributed to the tragic rockfall. Ronnie Hayden, the union secretary, criticized the mine's safety standards and questioned recent management restructuring that removed senior safety personnel. The union's comments underscore ongoing safety concerns and the importance of regulatory oversight in the mining industry. The incident has amplified calls for improved safety practices and stronger protections for workers."
2024-03-14 00:00:00,AUS_LAB,"The Australian Workers Union Victoria state secretary Ronnie Hayden expressed concern over safety issues at the mine, criticizing the use of unsupported air legging, which he claimed contributed to the accident. Hayden highlighted that union members had previously raised safety concerns that were ignored. The union's involvement emphasizes the importance of proper safety protocols and training in mining operations. Australian Labor policies have been referenced indirectly through the remarks of Premier Jacinta Allan, who indicated the possibility of strengthening laws for worker safety based on the incident. Overall, the union's stance underscores its role in advocating for safer working conditions and accountability in the mining industry."
2024-03-14 00:30:00,AUS_LAB,"The Australian Workers Union Victoria secretary Ronnie Hayden expressed concern over safety issues at the mine, highlighting that workers had previously raised safety concerns that were not addressed. He condemned the use of unsupported ground and air legging, which he indicated was inappropriate and unsafe for the mining conditions. Hayden emphasized the importance of prioritizing safety and suggested that negligence or recklessness could have contributed to the collapse. The union's involvement underscores ongoing labor issues related to mine safety and workers' rights to a safe working environment. The incident highlights the need for improved safety protocols and regulatory oversight in the mining industry."
2024-03-14 01:45:00,AUS_LAB,"The Australian Workers Union Victoria state secretary Ronnie Hayden was called to the Mount Clear mine after two miners became trapped underground. One miner was killed, and the union was involved in the rescue and recovery efforts. The union's role included responding to the incident and supporting the affected workers and their families. The incident highlights union concerns about workplace safety, particularly in underground mining operations. The union continues to advocate for improved safety measures to prevent future tragedies."
2024-03-14 02:15:00,AUS_LAB,"The Australian Workers Union Victoria state secretary Ronnie Hayden criticized the mine for ignoring safety concerns raised by workers. He highlighted that the workers and union members had previously flagged issues about unsafe practices, which he claims were disregarded. Hayden expressed concern over the use of air legging as unsafe for the setting, emphasizing the need for improved safety standards. The union's stance underscores the importance of prioritizing worker safety and addressing industry concerns. Overall, the article reflects the union's role in advocating for safer working conditions in the mining industry."
2024-03-14 02:45:00,AUS_LAB,"The Australian Workers Union Victorian branch secretary Ronnie Hayden has called for the implementation of workplace manslaughter laws following a fatal mine collapse, emphasizing their insufficient use despite multiple work-related deaths in Victoria. Hayden criticized management decisions, including the redundancy of a senior safety manager after a mine ownership change, which he blames for safety lapses. Union members raised concerns about the unsafe practice of reintroduced air-legging methods at the mine, which are linked to the cause of the accident. The union is demanding thorough investigations involving workers to determine accountability. Overall, the union is advocating for stricter enforcement of labor safety laws and accountability for employer negligence to prevent future fatalities."
2024-03-14 03:15:00,AUS_LAB,"The Australian Workers Union Victoria state secretary Ronnie Hayden attended the mine after the two miners became trapped underground. The union was informed of the fatality and the ongoing rescue operation, indicating their involvement in workplace safety and incident response. Hayden noted the incident involved unsupported ground, which is a safety concern linked to mining practices. The union’s role likely includes advocating for worker safety, participating in investigations, and supporting affected workers and their families. This incident underscores the importance of union oversight in ensuring safety protocols in underground mining operations."
2024-03-14 04:15:00,AUS_LAB,"The Australian Workers' Union (AWU) is actively campaigning for the use of industrial manslaughter laws following the death of a miner in a mine collapse at Ballarat Gold Mine. The union claims that unsafe mining practices, specifically air legging on unsupportive ground, contributed to the tragic incident and calls for accountability, emphasizing management faults and the redundancy of a safety manager. AWU Victoria Secretary Ronnie Hayden has stated they will push for manslaughter charges and highlighted concerns raised by union members that were ignored. The union views the incident as preventable and is advocating for stricter enforcement of existing health and safety laws. This situation underscores the union's role in advocating for worker safety and holding employers accountable for workplace tragedies."
2024-03-14 19:45:00,AUS_LAB,"The Australian Workers Union (AWU) Victorian branch secretary Ronnie Hayden criticized safety practices at the Ballarat Gold Mine, calling the death of a worker in a rockfall preventable. Hayden is urging WorkSafe Victoria to consider industrial manslaughter charges, alleging negligence related to the use of unsafe mining techniques like airleg rock drilling. Workers and safety campaigners have expressed concerns over insufficient safety regulations in Victoria's mining industry, comparing it unfavorably to Western Australia. The union highlights that safety issues have been raised prior to the recent tragedy, emphasizing the need for stronger oversight and safer practices. Overall, the union is advocating for improved mine safety standards and accountability to prevent future accidents."
2024-03-14 19:45:00,AUS_LAB,"The article highlights the plight of workers at the Avebury Nickel Mine in Tasmania, many of whom face job losses due to the mine's closure caused by declining global nickel prices. The Australian Workers' Union spokesperson, Robert Flanagan, expresses concern about the ""sense of despair"" among workers and emphasizes their efforts to find alternative employment within the industry. Workers are apprehensive about publicly sharing their stories due to fears of losing entitlements and future job prospects. The closure also negatively impacts local businesses and the community's economy. The union's role in protecting workers' rights and entitlements is implied as crucial during this economic downturn."
2024-03-18 06:30:00,AUS_LAB,"The Australian Workers' Union has called for industrial manslaughter charges following the death of miner Kurt Hourigan in the Ballarat Gold Mine collapse, citing concerns over unsafe working conditions. They have alleged that the air legging method used was not appropriate for the mine's ground, which contributed to the rockfall. An investigation by WorkSafe has been launched, focusing on allegations that safety complaints made by workers prior to the incident were ignored. The union's stance emphasizes the need for accountability and improved safety protocols in mining operations. This incident highlights ongoing issues related to workplace safety and labor rights within the mining industry."
2024-03-21 00:45:00,AUS_LAB,"Ronnie Hayden, the Victorian Branch Secretary of the Australian Workers' Union, has called for the contract for stage three works of the Pakenham Roads Upgrade to be referred to IBAC due to concerns over alleged corruption and opaque tender processes involving Major Road Projects Victoria (MRPV). He criticized the awarding of contracts to certain companies, suggesting that inflated costs and dodgy deals benefit companies rather than workers or the public. Hayden expressed frustration that funds from these projects are diverted from essential services like road maintenance and hospitals. He emphasized the need for IBAC investigation to uncover potential misconduct and to protect taxpayer money. The union leader's statements highlight labor's concern over transparency, integrity, and fair treatment of workers in public infrastructure projects."
2024-03-30 15:15:00,AUS_LAB,"The Australian Workers Union, represented by Victorian branch secretary Ronnie Hayden, condemned the use of unsafe ""air-leg"" mining methods at the Ballarat Gold Mine, which resulted in the death of miner Kurt Hourigan. Hayden stated that workers had previously raised concerns about this dangerous practice, which had been discontinued by most companies but was still being used at this mine. The union emphasized that the death was preventable and expressed outrage over the company's decision to resume operations shortly after the incident. The union also announced that there will be no further use of air-legging in the future. Overall, the union is actively advocating for safer working conditions and holding the employer accountable for the tragedy."
2024-04-02 04:15:00,AUS_LAB,"The article discusses the workplace trend of ""quiet cutting,"" where employers reduce employee responsibilities in hopes they will quit, which can create mistrust and potential legal issues under the Fair Work Act. This practice may be used as a strategy to avoid redundancy costs and difficult performance negotiations, raising concerns about fair treatment and workplace rights. Employees are advised to communicate with employers and document changes to protect their rights. The article highlights the importance of management transparency and employee performance in maintaining workplace trust. Overall, it underscores the need for fair labor practices and legal awareness within workplace dynamics."
2024-04-03 04:30:00,AUS_LAB,"The article does not mention any specific labor union activities, organizations, or responses regarding the workplace fatalities and safety issues. It primarily focuses on a recent spike in construction site falls resulting in deaths and injuries, emphasizing the importance of safety practices. The workplace health and safety regulator highlights the preventability of falls but does not detail union-led safety initiatives or advocacy efforts. Therefore, it is not directly related to labor unions.  
NA"
2024-04-03 08:15:00,AUS_LAB,"The article highlights safety concerns at the Ballarat Gold Mine, where warnings about the mine's stability, including the use of potentially risky 'air legging' techniques, were dismissed by previous management. The Australian Workers' Union (AWU) Victorian Secretary Ronnie Hayden expressed outrage upon learning about the air legging practices, emphasizing the community's concern over worker safety. Union representatives were unaware of the air legging being employed on-site, indicating a possible gap in oversight and communication. The incident, which resulted in a collapse and a recent fatality, has intensified broader safety and regulatory scrutiny within the mining industry. Employers and unions are likely to advocate for increased safety protocols and automation to reduce risks for underground workers."
2024-04-05 10:00:00,AUS_LAB,"The Australian Workers Union (AWU) faced criticism for its response to safety concerns at Ballarat Gold Mine, including its failure to prevent reintroduction of unsafe mining practices and its collaboration with management despite fatalities. Union officials did not oppose the reopening of the mine after the fatal collapse and continued to prioritize the mine's profitability over workers' safety. Union leadership also failed to take industrial action or enforce safety measures when safety concerns were raised by workers and experts. The article advocates for the formation of rank-and-file committees controlled by workers to improve safety and oppose profit-driven mine safety decisions. It concludes with a call for political change, including workers' control and socialist policies, to ensure workers’ safety and interests are prioritized."
2024-04-08 21:45:00,AUS_LAB,"The article discusses legislation passed by the South Australian Labor Government that ensures employees working on Easter Sunday receive public holiday penalty rates, aligning the state with other Australian jurisdictions. The legislation also guarantees penalty rates for employees working on Christmas Day if it falls on a Saturday. These changes aim to protect workers' rights and improve public holiday entitlements. The Labor Government emphasizes its commitment to workers, contrasting its policies with opposition criticism. Overall, the legislation enhances workers' holiday rights and progresses fair pay practices."
2024-04-10 07:00:00,AUS_LAB,"The article emphasizes the importance of Australian workers understanding their legal rights, including protections against discrimination, harassment, and unfair treatment in the workplace. It highlights that labor unions play a crucial role in advocating for workers' rights and ensuring compliance with laws such as the Fair Work Act 2009 and the National Employment Standards. Unions often assist employees with issues related to wages, working hours, redundancy, and workplace safety. They empower workers to address grievances and promote fair employment practices. Overall, staying informed and seeking support from organizations like Fair Work and unions is essential for fostering fair and safe workplace environments."
