date_time,record_id,summary
2021-01-09 14:15:00,AUS_LAB,The article does not directly mention labor unions.
2021-01-10 19:00:00,AUS_LAB,"The article discusses the concept of ""just transition,"" emphasizing its importance in supporting workers and communities affected by the decline of the fossil fuel industry, particularly in Australia. It highlights the roles of unions and community groups advocating for orderly, fair transitions through retraining, early retirement packages, and land remediation to prevent economic devastation in coal regions. Australian unions, such as the Australian Manufacturing Workers Union and others involved in the Hunter Jobs Alliance, seek to ensure workers are not left behind as the energy sector shifts to renewables. However, there is internal disagreement within unions and political parties about the pace and implementation of these transition strategies. The success of models like Germany’s ""no one left underground"" approach offers a blueprint for Australia’s union-led efforts to promote a just and inclusive energy transition."
2021-01-13 12:45:00,AUS_LAB,"The article discusses workers' rights and employer obligations regarding return-to-work policies during the COVID-19 pandemic. It highlights that employees can request flexible arrangements, such as working from home, under specific circumstances, though employers may refuse these requests. Labor unions or workers' legal representatives advise workers to consult unions or lawyers if they believe a return-to-office demand is unreasonable or unsafe. Workers are warned that refusal to comply with lawful directions could lead to warnings or dismissal, but there is ongoing debate about reforming laws to better protect workers' rights. The overall emphasis is on balancing workers' safety, rights, and employers' responsibilities in a COVID-normal world."
2021-02-01 06:45:00,AUS_LAB,"The United Workers Union (UWU) is accused of failing to inform or support workers at the Coles Heathwood warehouse during their planned closure and the lock-out at Smeaton Grange. Workers express frustration over the union's inaction and support for management's restructuring plans, which threaten thousands of jobs. Workers report harassment, intimidation, and a lack of transparency from management, with insufficient communication about closure dates and workers' rights. The WSWS and Socialist Equality Party advocate for building independent rank-and-file committees to oppose closures and defend employment, criticizing the union's betrayal. Workers are urged to organize independently to fight the company's offensive and prevent job losses."
2021-02-05 05:00:00,AUS_LAB,"The article discusses opposition among Coles warehouse workers to the United Workers Union’s (UWU) efforts to implement a sell-out enterprise agreement at the Smeaton Grange warehouse in Sydney, with workers voting down the deal. Workers and the Socialist Equality Party (SEP) criticize the UWU for suppressing information, undermining workers’ rights, and failing to adequately defend employees during a lockout and COVID-19 crisis. The SEP advocates for independent rank-and-file committees and a unified industrial struggle across supermarkets like Coles and Woolworths to oppose warehouse closures and job losses. Several warehouses across Sydney, Melbourne, and Brisbane are threatened with closure, further endangering thousands of jobs, with workers expressing distrust toward union representatives. The article emphasizes the need for independent worker organization and collective action to fight job cuts and union betrayals."
2021-02-08 23:00:00,AUS_LAB,"The Australian Workers' Union (AWU) is advocating for stricter national safety regulations to protect all workers from silica dust exposure, beyond just stonemasons. The AWU has launched a campaign calling for the Federal Government to establish minimum safety standards and harsher penalties across industries. Maurice Blackburn, a law firm supporting the union, criticized the government for its inadequate response and emphasized the dangers faced by workers in various sectors like mining and tunneling. Joanna McNeill, a miner diagnosed with silicosis, is leading the union’s efforts for urgent regulatory reforms to prevent similar health tragedies. The union highlights the urgent need for comprehensive workplace protections to safeguard workers’ health and families."
2021-02-09 21:00:00,AUS_LAB,"The Australian Workers' Union (AWU) is campaigning for the federal government to impose stricter safety regulations and minimum benchmarks to protect workers from silica dust exposure. Maurice Blackburn, a law firm specializing in dust disease cases, is supporting the campaign, highlighting concerns about industry safety practices. The campaign emphasizes the need for broader protection beyond engineered stone, citing cases of workers suffering from silica-related illnesses due to lax safety measures. Industry advocates criticize the government's slow response and call for urgent legislative reforms to prevent fatalities. The coalition seeks to ensure all Australian workers have access to best practice safety standards to safeguard their health and well-being."
2021-02-16 00:30:00,AUS_LAB,"The article discusses the decline of Australian trade unions, noting their continued shrinking impact despite wage stagnation and workforce issues. It highlights the framing of industrial relations debates in the media, often portraying unions negatively and emphasizing the perceived costs to businesses of worker protections. The article criticizes the focus on business costs related to worker protections and wages, ignoring the substantial economic losses workers have faced due to wage stagnation and reduced bargaining power. It emphasizes that workers have been denied approximately $50 billion since 2014 due to restrained wage growth, which could have benefited low-income workers. Overall, it advocates for a balanced discussion on industrial relations reform that considers the economic detriments borne by workers."
2021-02-16 01:15:00,AUS_LAB,"The article highlights the historical significance of the Sunshine Harvester and its role in establishing Australia's first minimum wage through the 1907 Harvester Judgement, a landmark case in industrial relations. It emphasizes the importance of fair wages and workers' rights, echoing the ongoing influence of labor unions in advocating for decent working conditions. The restoration of the harvester by volunteers symbolizes respect for workers' history and the ongoing struggle for fair labor standards. The Blacktown Workers Memorial Precinct serves as a reminder of past and present labor issues, honoring workers who have been killed on the job. Overall, the article underscores the legacy of labor movements and unions in shaping fair wage policies and workers’ protections in Australia."
2021-02-16 04:00:00,AUS_LAB,"The article highlights the conflict between Coles Group management and workers at its Smeaton Grange warehouse, where the United Workers Union (UWU) is involved in opposing management’s attempts to force a sell-out deal leading to job losses. The management, backed by corporate interests and investment funds like BlackRock and Vanguard, has extended a lockout to pressure workers into accepting closures and automation plans that threaten employment. The Socialist Equality Party (SEP) criticizes traditional unions and advocates for independent workers’ organizations and a political struggle for socialism and workers’ control. The article emphasizes the broader class struggle against the profit-driven capitalist system and calls for workers’ self-organized resistance. Overall, it underscores the role of unions and worker protests within the broader fight against corporate and government efforts to exploit the pandemic and automate jobs."
2021-02-16 07:15:00,AUS_LAB,"The article does not specifically mention any labor union activities or involvement. It focuses on new laws in Victoria that facilitate quicker access to mental health treatment and support for workers through the WorkCover scheme. The reforms aim to improve workers' recovery and return-to-work prospects, especially for mental health injuries. However, there is no indication of labor union actions, negotiations, or advocacy related to these legal changes. Therefore, the article is not directly relevant to labor unions."
2021-02-16 10:00:00,AUS_LAB,"The article highlights criticism from Labor opposition leader Jared Cassidy regarding the safety of Brisbane bus drivers, emphasizing the need for full driver barriers and increased security measures. Cassidy accused the LNP mayor Adrian Schrinner of ignoring calls for better safety protections despite high assault figures, and criticized the council's expenditure priorities. The opposition advocates for stronger workplace safety measures for bus drivers, aligning with labor union concerns about workers’ safety. The council and public transport officials defend current safety efforts, citing investments in CCTV, barriers, and training, while noting the low incidence rate of assaults. Overall, the article reflects ongoing debates over workplace safety and protective measures for bus drivers, a concern often associated with labor unions."
2021-02-23 07:15:00,AUS_LAB,"The article discusses the role of the United Workers Union (UWU) in the ongoing dispute with Coles over the lockout of workers at the Smeaton Grange warehouse, highlighting its perceived failure to support the locked-out workers and its efforts to isolate the dispute. It criticizes the union for aligning with management to push through a sell-out enterprise agreement, including warehouse closures and job reductions. The article calls for independent worker-organized action, outside of union control, to support the locked-out employees and resist management plans. It emphasizes that the unions act as an industrial police force, opposing efforts for worker-led struggles due to legislation that restricts strikes and protests. The piece advocates for worker solidarity and independent coordination among logistics and warehousing workers to strengthen their fight against management and union suppression."
2021-02-24 08:15:00,AUS_LAB,"A coalition of unions, including the Australian Workers' Union, Transport Workers' Union, and Shop Distributive and Allied Employees' Association, has called for a royal commission into the fruit and vegetable industry due to ongoing exploitation issues. They cite reports of violence, harassment, passport confiscation, forced slavery, and excessive working hours, claiming previous inquiries have been inadequate. The unions advocate for changes in pay structure, specifically concerning piece rates, to ensure minimum wages for workers. The federal government and industry bodies have dismissed the call, citing existing investigations and initiatives aimed at addressing labor issues. The unions insist that stronger oversight is necessary to combat exploitation in the horticulture sector."
2021-03-01 03:15:00,AUS_LAB,"The article does not directly address labor unions but highlights important employment law considerations regarding Covid-19 vaccination policies. Employers must balance their duty to provide a safe workplace under OSHA 1994 with employee autonomy, especially when considering mandatory vaccination. Healthcare workers and employees from high-risk countries may face justified vaccination requirements, while refusal to vaccinate may not typically constitute just cause for termination. Employees who refuse vaccination, particularly with medical reasons, could challenge termination, evidenced by cases like the Australian care worker ruling. Employers should seek legal advice when developing vaccination policies to avoid legal repercussions and ensure employee rights are protected."
2021-03-06 05:00:00,AUS_LAB,"The article details multiple labor union protests and strikes across India, Sri Lanka, Australia, and other regions. Workers from various sectors, including steel plant employees, village administrative officers, gold miners, transport workers, healthcare staff, and industrial workers, have organized demonstrations to demand better wages, improved working conditions, and the reversal of government policies impacting employment and social welfare. Specific protests include opposition to privatization, disinvestment plans, rising fuel prices, and inadequate safety measures. Notable actions involve sit-down protests, roadblocks, strikes, and work-to-rule campaigns conducted by organized labor groups and trade unions. These collective actions reflect widespread worker discontent with current labor policies, economic conditions, and workplace safety standards."
2021-03-09 01:00:00,AUS_LAB,"The Australian Workers Union expressed strong disapproval of Vestas' decision to offshore the wind turbine towers for the Ryan Corner wind farm, emphasizing the threat to 150 local jobs at Keppel Prince Engineering. Union representatives criticized the Federal Government for not taking sufficient action to protect Australian manufacturing jobs and enforce standards on steel quality and safety. They argued that government mandates ensuring all steelwork complies with Australian Standards could help safeguard local employment. The union highlighted the importance of manufacturing for regional economic recovery post-COVID and called for government support and investment in this sector. Overall, the union advocates for policies prioritizing local manufacturing to preserve jobs and ensure safety standards."
2021-03-15 01:45:00,AUS_LAB,"The Australian Workers Union (AWU) has publicly undermined Labor leader Jodi McKay in New South Wales, criticizing her performance and opposing her climate policies. The union has history of internal conflicts, having previously opposed Labor figures like Kevin Rudd and supporting rival candidates within the party. The AWU is strongly opposed to climate action, lobbying to weaken Labor's commitments to climate policies and opposing specific projects like Santos’ Narrabri gas development. The union's actions reflect its broader interest in protecting fossil fuel interests, even if it conflicts with party leadership. This demonstrates the AWU's significant influence and willingness to influence political direction within the Labor Party, particularly concerning climate policy."
2021-03-16 08:15:00,AUS_LAB,"The article criticizes the role of the United Workers Union (UWU) during the Coles Smeaton Grange warehouse lockout, portraying it as collaborating with management and betraying workers' interests by promoting a sellout agreement and refusing strike support. It highlights the need for independent workers’ organizations, such as rank-and-file committees, to oppose the union bureaucracy and defend workers’ rights independently. The event discussed the broader crisis of union leadership, with calls for workers to develop their own democratic organizations outside traditional unions to better resist management and capitalist interests. The article also criticizes the influence of pseudo-left groups like Solidarity, which opposes political and organizational independence from unions. Overall, it emphasizes the importance of workers establishing independent, democratic organizations to lead class struggles and resist capitalist exploitation."
2021-03-18 13:30:00,AUS_LAB,"The article discusses the Australian government's failed attempt to pass a comprehensive industrial relations bill, which included measures relevant to workers' rights. One key provision would have allowed casual workers on regular rosters to convert to permanent employment without casual pay loading. The bill's collapse in the Senate prevented the implementation of this and other reforms, limiting protections and benefits for workers. The article suggests that the missed opportunities reflect a lack of focus on workers' interests from the political class. Overall, it highlights ongoing challenges in labor relations and union advocacy in Australia."
2021-03-24 07:45:00,AUS_LAB,"The article highlights a strike by over 100 mental health workers in Perth, demanding increased funding and resources for child mental health services, which is organized by the Health Services Union WA. Workers fear the lack of support and staffing, citing ongoing underfunding, lead to long waiting times and potentially tragic outcomes, including a recent child death. The union has criticized the government for not implementing previous recommendations, including staffing improvements. The strike is described as a last resort, reflecting broader concerns about patient care and systemic pressure in hospitals and mental health services."
2021-03-27 01:00:00,AUS_LAB,"The article details various labor protests and strikes across multiple sectors, including steel workers at Bokaro Steel Limited demanding overdue wages, and motorcycle workers at Royal Enfield protesting management’s union initiatives and reclassification attempts. Medical staff, nurses, and health workers in multiple states protested against unpaid leave cancellations, layoffs, and inadequate funding for mental health services. Employees in the insurance sector, Sri Lankan educators, Bank of Ceylon employees, and government workers in Sri Lanka organized protests for fair wages, pensions, and proper employment conditions. Support workers in New Zealand and Australia went on limited strikes over pay, conditions, and funding issues, including homecare workers demanding fair hours and pay amid ongoing disputes with Lifewise. Overall, the article illustrates widespread activism reflecting labor unions' efforts to secure better wages, job security, and improved working conditions across diverse industries."
2021-03-27 02:00:00,AUS_LAB,"The article mentions a call for a national portable long service leave scheme in Australia, highlighting that only one in four Australians stay with the same employer for 10 or more years. It discusses the different long-service leave entitlements across jurisdictions and the benefits of such a scheme for workers like Tess Harbeck, who earned her leave after 10 years of service at the bakery. The conversation indicates an interest in improving employee rights and benefits, which are relevant topics for labor unions advocating for workers’ entitlements and job security. The bakery's recognition of long service and flexible leave arrangements may also reflect union influence or discussions. Overall, the mention of long-service leave policies relates to labor union concerns about workplace benefits and protections."
2021-03-28 07:00:00,AUS_LAB,"The article highlights a workplace dispute involving an employee who was threatened with termination after not showing up for a shift he had been authorized to miss for a personal event, raising issues of employee rights and managerial authority. The employee asserts that his leave was approved by another manager, and he was unfairly threatened with warnings despite fulfilling his contractual work hours and informing management of his absence. Discussions among Reddit users suggest the situation may involve power struggles and improper management behavior, reflecting broader concerns about workplace respect and communication. While the article does not explicitly mention a labor union or union involvement, the underlying tensions related to employment rights and workplace treatment could be relevant to union advocacy or collective bargaining efforts. Overall, the case underscores potential conflicts between workers and management that could be addressed or mediated by labor unions."
2021-03-29 06:00:00,AUS_LAB,"Workers at Nestlé's Wiri plant in Auckland, represented by the union E tū, are confronting a proposed restructuring that could result in the loss of nearly 40% of union members' jobs and the cessation of confectionery manufacturing at the site. E tū is calling on Nestlé to prioritize redeployment, skills credentialing, and active collaboration to find alternative employment for affected workers, ensuring fair redundancy entitlements. Union representatives emphasize the significance of stable employment for community well-being and criticize the company's decision-making process, especially given recent global corporate closures like Cadbury in Dunedin. The union advocates for decisions that prioritize workers' interests and job security, especially in the wake of economic recovery efforts post-COVID-19. This situation highlights the union's role in advocating for worker protections amid corporate restructuring."
2021-03-29 21:30:00,AUS_LAB,"The article highlights the employment issues faced by Vanuatu seasonal workers in Bundaberg, with some workers leaving due to poor conditions and accommodation grievances. While some workers have rejoined the federal Seasonal Worker Program, others remain uncontacted or are suspected to have moved interstate or abroad, raising concerns about potential violations of visa conditions. The Department of Home Affairs and Border Force are actively monitoring and investigating labor exploitation and illegal employment activities. The situation underscores the need for stronger oversight and protections for foreign workers, which is relevant to labor rights and union interests. However, there is no direct mention of a labor union or organized labor movement in the article.  
NA"
2021-03-30 03:00:00,AUS_LAB,"The Australian Council of Trade Unions (ACTU) President Michele O’Neil criticized the ending of the JobKeeper wage subsidy, warning it will lead to significant job losses and increased economic hardship, especially for women and regional communities dependent on tourism. ACTU has also called for a 3.5% minimum wage increase, advocating for workers' security and stability amid economic recovery efforts. Australian unions are actively addressing labor issues related to gig economy companies like Deliveroo, which faces scrutiny over riders' working conditions, wages, and safety, with reports of pay decreases and work-related injuries. The Transport Workers Union (TWU) has highlighted exploitation, wage theft, and dangerous working conditions faced by food delivery riders, many of whom have experienced injury and financial hardship. Overall, labor unions in Australia are focusing on job protection, wage growth, and improved working conditions for workers impacted by economic shifts and gig economy practices."
2021-03-31 05:15:00,AUS_LAB,"The Australian Workers' Union (AWU) applauds the Australian Labor Party for committing to address the silicosis epidemic. AWU's Acting National Secretary, Misha Zelinsky, praised the party's leadership in proposing a national response to occupational lung diseases, including silicosis. Zelinsky emphasized that current safety standards are inadequate and that Australian workers face greater risks from silica dust than those in some other countries. The AWU has been advocating for stricter national regulations and better enforcement to protect workers. The union highlights the importance of government action to prevent this preventable and life-altering disease."
2021-04-05 00:30:00,AUS_LAB,"The Australian Workers Union (AWU) has intervened in Tasmania's Labor Party preselection process, urging the national executive to overturn decisions that excluded popular Kingborough mayor Dean Winter as a candidate for Franklin. The AWU's acting national secretary, Misha Zelinsky, accused the Tasmanian state administrative committee of rule breaches and deliberate manipulation to block Winter’s preselection, which he claims damages the party’s electoral prospects. The union alleges that there was a concerted campaign to prevent Winter from running, involving unfair practices and agenda changes. The intervention highlights internal conflicts within the Labor Party, driven by factional disputes, particularly between the left and right factions. Overall, the AWU is advocating for a fair preselection process to support member Winter's candidacy and improve the party's chances in the election."
2021-04-23 02:00:00,AUS_LAB,The maritime union is calling on the National Cabinet to quickly adopt enhanced testing and biosecurity protocols for vessels arriving from international ports. This demand follows a COVID-19 outbreak onboard a gas tanker that recently docked at Port Botany. The union's urgent appeal emphasizes the need for increased safety measures to prevent further outbreaks. The union’s actions highlight its role in advocating for maritime workers' health and safety amid the pandemic.
2021-04-23 02:15:00,AUS_LAB,"The article highlights concerns about the Australian government's prioritization of foreign migrants, students, and workers over stranded Australian citizens during the pandemic. It criticizes the government's handling of quarantine and travel policies, which have left many Australians stranded abroad while allowing more foreigners to enter. The article also accuses politicians of abandoning their duty to protect Australian workers and citizens, instead focusing on industry interests and cheap foreign labor. It calls for greater responsibility from the government and states to prioritize Australian citizens' welfare. Overall, it underscores a disagreement with current policies affecting Australian workers and citizens, relevant to labor rights and union interests."
