date_time,record_id,summary
2023-09-04 10:30:00,AUS_LAB,"The article highlights a strike by casual workers at Mint My Desk and Million-life stores in Brisbane, who are protesting over unpaid wages, lack of payslips, and underpayment below award wages. The employees, many of whom are students, have raised concerns with the Fair Work Ombudsman, Fair Work Commission, and the Australian Taxation Office. The Distributive and Allied Employees’ Association (SDA) was contacted for comment, representing retail workers. Management has acknowledged the allegations and is investigating, with some stores temporarily closing due to the publicity. The situation underscores ongoing issues of labor rights and employer compliance within the retail sector."
2023-09-06 07:15:00,AUS_LAB,"The Australian Workers' Union (AWU) welcomed the Albanese Government's announced Carbon Leakage Review and the appointment of Professor Frank Jotzo to lead it. AWU National Secretary Paul Farrow emphasized the importance of the review in balancing climate change policies with supporting industries and workers. He criticized the idea of shutting down factories domestically, noting that it could lead to increased carbon-intensive production overseas. Farrow highlighted the potential benefits of a Carbon Border Adjustment Mechanism to prevent carbon leakage. The union expressed its support and readiness to collaborate with the government on the review."
2023-09-18 11:45:00,AUS_LAB,"Illawarra unions have launched a community alliance in support of a proposed offshore windzone, viewing it as a significant opportunity for green jobs. The initiative has been in development for 15 years, with collaborative efforts from the South Coast Labour Council, Business Illawarra, the University of Wollongong, and local councils. The alliance aims to mobilize workers from steel, manufacturing, and transport sectors along with community climate advocates. The project is expected to create approximately 3,000 to 8,000 jobs nationally, with about 3,750 jobs anticipated in the Illawarra during construction and ongoing roles. Union representatives emphasize this as a ""once in a lifetime"" opportunity to capitalize on regional capacity for renewable energy development."
2023-09-19 06:45:00,AUS_LAB,"The article reports ongoing strikes at Chevron’s Gorgon and Wheatstone LNG units in Australia, which are responsible for about 5-6% of global LNG supply. These strikes have not yet caused complete shutdowns, and workers are scheduled to meet on September 22 to negotiate. The impact on the market has been limited so far, as companies are not actively seeking replacement loads, and the market remains cautious. The situation highlights the influence of labor unions on LNG production and global supply stability. Additionally, problems at a US LNG facility further complicate the natural gas market, indicating ongoing labor and operational issues."
2023-09-20 02:30:00,AUS_LAB,"The Finance Sector Union (FSU) representatives will testify at the Senate Inquiry into bank closures in regional Australia, highlighting the negative impact on communities. They will emphasize that decisions to close branches are based on incomplete transaction data and that many essential interactions cannot be performed at post offices. The union advocates for banking to be recognized as an essential service, obligating banks to serve rural and regional areas. FSU representatives are scheduled to provide evidence at 1.40 pm. The hearing will also include testimony from chief executives of major banks."
2023-09-21 02:30:00,AUS_LAB,"The Australian Workers' Union (AWU) criticized Molycop's decision to cease steel-making and bar mill operations at the Waratah site, resulting in approximately 250 redundancies. The AWU estimates that about half of the affected workers are union members. AWU New South Wales Branch Secretary Tony Callinan stated that the union is working with management to ensure affected workers receive full entitlements and re-training opportunities. The union described the closure as a painful shock and a sad day for the Hunter community and the Australian manufacturing industry. Their immediate focus is on minimizing hardships through voluntary redundancy offers and re-training programs."
2023-09-22 07:15:00,AUS_LAB,"Members of the Offshore Alliance union at Chevron's Gorgon and Wheatstone LNG operations in Australia went on strike over remuneration disputes. The union members recently endorsed a deal proposed by the Fair Work Commission, which includes improvements in employment conditions such as increased pay, job security, locked-in rosters, and career advancement. The union, led by the Australian Workers’ Union Western Australia secretary Brad Gandy, will now work with Chevron to finalize the agreement, and industrial actions are expected to cease soon. The union's decision was based on careful consideration of the Commissioner's recommendations, reflecting successful collective bargaining."
2023-09-22 19:30:00,AUS_LAB,"Australian trade unions, including the Australian Workers’ Union and the Maritime Union of Australia, announced the end of their strike actions at Chevron's three gas plants. They agreed to accept an arbitrator’s recommendation to resolve a dispute over pay and working conditions. The Offshore Alliance, representing offshore oil and gas industry workers, was involved in brokering the resolution. This decision concludes the strike actions initiated by the unions. The unions' action aimed to address concerns over employment terms at Chevron Australia."
2023-09-26 13:00:00,AUS_LAB,"The article discusses a proposed review of Australia's award system by the Fair Work Commission (FWC), prompted by a request from Labor Minister Tony Burke, to improve clarity and sustainability. Unions are concerned about potential negative impacts of simplified awards on workers' entitlements, emphasizing the importance of protecting minimum conditions. The review focuses on seven awards, covering industries with predominantly low-paid workers, many of whom are women. Labor unions are likely to be engaged in discussions to ensure that reforms do not undermine workers’ rights or entitlements. Overall, the article highlights the tension between simplifying labor regulations and safeguarding workers' protections, with union involvement being a key factor."
2023-09-26 14:00:00,AUS_LAB,"The article critiques the Australian Government's Fair Work Legislation Amendment (Closing Loopholes) Bill, highlighting concerns raised by Business Council chief executive Bran Black. The opposition emphasizes that the legislative data and assumptions, particularly regarding casual employee conversion processes, are flawed, unrealistic, and underestimate the costs to businesses. Black suggests that the estimated time and financial impact of implementing the new test for casual employees are overly simplified and unreliable. He warns that the proposed changes could lead to increased costs, confusion, and disputes within the workplace relations system. Overall, the article reflects the Labor Union's concern about the potential negative impacts of the legislation on workers and employers."
2023-09-26 18:15:00,AUS_LAB,"The Australian Workers’ Union (AWU) and the Australian Manufacturing Workers Union (AMWU) criticized Molycop’s decision to cut nearly half of its workforce at the Newcastle site, describing the layoffs as a painful shock and noting the lack of warning. Union representatives expressed concern over the long history of the steel mill, the community impact, and the uncertainty about future work at the site amid competition from imported steel. The unions emphasized the importance of supporting affected employees and highlighted the broader implications for Australian manufacturing. They also pointed out that the decision was made without prior consultation or warning, reflecting concerns about employment security and industry sustainability."
2023-09-28 22:30:00,AUS_LAB,"The article details the history and recent activities of labor unions and strikes worldwide, highlighting key protests such as those by ancient Egyptian tomb-builders, Roman plebeians, and more recent strikes by miners, auto workers, airline controllers, and media professionals. It emphasizes major strikes advocating for better wages, working conditions, and rights, including the fight for the 8-hour workday and responses to modern issues like AI protection and streaming industry impacts. Notable modern strikes include the UAW's 2023 actions demanding improved wages and benefits, the Writers Guild of America and SAG-AFTRA strikes over streaming and AI concerns, and historic events like the Pullman strike and the British miners' strike. These labor actions have historically led to significant changes in labor laws, workers' rights, and workplace conditions. Overall, the article illustrates the ongoing importance and impact of union activity in shaping labor rights across centuries."
2023-10-01 18:45:00,AUS_LAB,"The article highlights concerns about occupational health and safety at Australia's Boddington gold mine, emphasizing the importance of health monitoring for workers exposed to silica dust. It notes that the Mining and Energy Union has pointed out that the shift from prescriptive legislation to a risk-based approach in the 1990s has contributed to inadequate health surveillance, particularly for former workers. The union advocates for proper health monitoring and screening programs to prevent silicosis among all workers, including contractors and retirees. It also underscores the need for regulatory changes to ensure comprehensive health protections and screenings are available beyond current employees. Overall, the union is advocating for improved safety measures and health rights for mining workers exposed to silica dust."
2023-10-08 00:00:00,AUS_LAB,"The article highlights significant shortages of skilled workers, including electricians, engineers, and tradespeople, critical for Australia's transition to a renewable energy economy, emphasizing the need for education, training, and migration reforms. Labor unions could play a vital role in advocating for more inclusive pathways for women and First Nations workers, helping to fill skill gaps in clean energy roles. The report suggests that boosting vocational training and apprenticeships, supported by policies like the Australian Skills Guarantee, is essential for meeting future workforce demands. Unions may also need to address job transitions for workers in emissions-intensive sectors, ensuring secure employment during Australia's decarbonization efforts. Overall, the development of a skilled, diverse workforce for clean energy is crucial, and unions could be key partners in these initiatives."
2023-10-11 08:15:00,AUS_LAB,"The Sparkies Union has urged the Albanese government to intervene and prevent the outsourcing of jobs by contractor Downer, which is planning to transfer work to cut costs. The Electrical Trades Union has protested to Defence Minister Richard Marles regarding the outsourcing of 31 electricians and plumbers at Australian Defence Force sites in Queensland. The union claims that this move is contrary to the government's efforts to combat labor hire exploitation. The company’s decision to outsource is part of its cost-cutting measures. The union’s appeal highlights ongoing tensions between labor protections and corporate outsourcing practices."
2023-10-17 07:00:00,AUS_LAB,"The article highlights the opposition to the Indigenous Voice to Parliament referendum in Australia, with Socialist Equality Party (SEP) members campaigning for an active boycott, criticizing the Labor Party and the political establishment for supporting measures they see as serving the interests of the affluent Aboriginal elite and perpetuating societal divisions. Workers and youth express distrust in the government, linking poor living conditions for Indigenous communities to broader social and economic austerity affecting the working class. Several individuals, including workers and students, criticize governmental spending on military and war preparations rather than addressing urgent domestic issues such as healthcare, housing, and poverty alleviation. The SEP's campaign emphasizes the need for class-based solidarity over racial politics and opposes what they see as capitalist exploitation and imperialist policies. Overall, the discourse reflects a broader dissatisfaction with the Labor government’s policies, viewed by the SEP and participants as failing the working class and indigenous populations alike."
2023-10-18 00:30:00,AUS_LAB,"The Australian Workers Union (AWU) expressed concern over the closure of Glencore's copper mining operations in Mount Isa, which will impact hundreds of union members. AWU Queensland Secretary Stacey Schinnerl urged the government to expedite approvals for new mines and called on Glencore to prioritize redeploying local workers to other roles, including FIFO and foreign labor. The union emphasized the long-standing contributions of Mount Isa Mines workers to Queensland’s economy and stressed the importance of community support and dignity for affected workers. AWU officials are actively supporting members and organizing a community meeting to address the closure. The union is committed to holding the government and Glencore accountable for providing support to the impacted community."
2023-10-18 02:45:00,AUS_LAB,"The Australian Workers’ Union described the closure of the Mount Isa copper mine as an incredibly sad day for the community and has called on the government to provide support to affected workers. Queensland secretary Stacey Schinnerl has contacted Treasurer Cameron Dick to ensure support and dignity for the displaced workers and the community. The union expressed intentions to hold both the government and Glencore accountable in delivering assistance. Redundancies are considered a last resort, with the union advocating for worker support during the transition. Overall, the union is actively involved in advocating for affected employees and the broader community impacted by the mine’s closure."
2023-10-18 03:45:00,AUS_LAB,"The Australian Workers Union (AWU) has called on the Queensland government to support affected workers at Glencore's Mt Isa mine closures, urging for redeployment opportunities and prioritization of local labor. The union emphasizes the importance of quick government approvals for new mines to aid transition and retain jobs in the region. It advocates for direct support and measures to ensure dignity and employment for displaced workers. The AWU also criticizes Glencore's current use of foreign and fly-in, fly-out labor, pushing for local workforce prioritization. Overall, the union is actively involved in advocating for worker rights and community support amid the mine closures."
2023-10-24 03:30:00,AUS_LAB,"Ground workers, cabin crew, and pilots at Virgin Australia are seeking to hold a Protected Action Ballot through the Fair Work Commission due to unresolved disputes over low pay, insecure work, and safety issues. The Transport Workers' Union (TWU) has highlightedworkers’ frustrations with Virgin’s failure to fulfill COVID-era wage and condition commitments, despite the airline reporting a substantial profit. Workers are demanding fair wage adjustments, more secure employment, better rostering, and safety provisions, threatening industrial action if demands are not met. TWU National Assistant Secretary Nick McIntosh emphasized the workers’ loyalty during the pandemic and their desperation due to unsustainable work conditions. The union accuses Virgin of having some of the lowest wages in the industry and is advocating for an independent Safe and Secure Skies Commission to improve job security, service standards, and fair ticket prices."
2023-10-24 07:00:00,AUS_LAB,"The article highlights the efforts of Fiji's Minister for Employment, Productivity and Industrial Relations, Agni Deo Singh, to support Fijian workers under the PALM Scheme in Australia. He emphasized the importance of worker dedication and acknowledged their contributions to both their families and the broader community. Singh encouraged workers to follow grievance procedures and report concerns through the designated Country Liaison Officer. The meeting served as a platform for workers to share their experiences and challenges, reinforcing the government's commitment to their welfare. Overall, the article underscores the role of the labor union infrastructure in supporting migrant workers and ensuring their rights are protected."
2023-10-31 01:00:00,AUS_LAB,"The Australian Workers Union's representative, Robert Flanagan, emphasized the importance of investigating the explosion incident at Henty Gold Mine to determine what went wrong. He highlighted the ongoing investigation by WorkSafe Tasmania and the prohibition on firing at the mine pending its findings. Flanagan expressed concern about the incident, noting that although there were no serious injuries, one miner sustained bruises and lacerations. The union officials are actively involved, speaking with the crew and awaiting the investigation results to ensure safety and accountability. This reflects the union's role in advocating for worker safety and ensuring workplace incident investigations are thorough."
2023-11-01 08:00:00,AUS_LAB,"Fijian labor unions support the establishment of direct deductions from workers' superannuation into the Fiji National Provident Fund (FNPF). They are involved in ongoing discussions with the government to address the complex process and high tax burdens faced by workers accessing their superannuation after working abroad under the Pacific Labor Mobility Scheme. Labor unions, along with registered employers, are advocating for policies that would simplify access and reduce the tax deductions, which currently amount to 35%. The unions' support is crucial in seeking agreements with Australia to facilitate these direct deductions. The efforts aim to improve financial benefits for Fijian workers participating in the scheme."
2023-11-03 18:15:00,AUS_LAB,"The union representing approximately 3,600 workers at Crown Melbourne casino is preparing for a protected strike during the spring racing season due to unresolved disputes over wages, overtime, and holiday pay. The union members, having approved the strike by majority vote, are demanding fair pay increases and better treatment amid rising living costs. The employer disputes the number of workers eligible to strike but acknowledges ongoing negotiations. Crown Melbourne reported significant revenue but also a net loss, while the union emphasizes the need for a fairer settlement. The company's CEO assures that operational impacts will be minimized during the potential strike."
2023-11-06 07:30:00,AUS_LAB,"The article criticizes Australia’s trade union leadership, particularly the Maritime Union of Australia (MUA), for their lack of action against Israel’s military actions in Gaza and their close alignment with the Labor government. It highlights that unions have largely remained silent or issued tepid statements during the Gaza conflict, refusing to call strikes or industrial action to oppose the war crimes. Union officials, including leaders from the MUA, have dismissed calls for concrete action, citing legal restrictions and their political ties to the Labor Party. The article condemns this union bureaucracy as pro-imperialist and argues that their cooperation with state and corporate interests undermines workers' solidarity and resistance. It emphasizes the need for independent class-based action to oppose this complicity and support Palestinian struggles."
2023-11-07 01:30:00,AUS_LAB,"The Victorian Ambulance Union expressed concerns about delays in emergency response times along the NSW border, particularly noting a tragic case of delayed ambulance response resulting in a woman's death. They called for further investigation into the prolonged resolution process and the potential harm caused to patients. The union welcomed recent improvements, including the implementation of an upgraded call routing system designed to direct emergency calls to the nearest available ambulance service, regardless of whether it is in NSW or Victoria. They also suggested that the delays might have been caused by system updates at Telstra, which Telstra denied. The union emphasized the need for accountability and continued oversight to ensure timely emergency medical responses."
2023-11-07 06:15:00,AUS_LAB,"The article highlights the role of unions in opposing the war and supporting the Palestinian struggle, specifically criticizing Australian unions for backing government policies supporting Israel’s actions. It mentions the Maritime Union of Australia, which, despite claims of opposition to the war, threatened union members who inquired about industrial action against military shipments to Israel. The article emphasizes the importance of the international working class and union movement in mobilizing resistance and organizing strikes to prevent war. It also notes widespread restrictions on protests and union activities in various countries, including Australia, France, and Germany. The call to action underscores the need for union-led efforts to build a socialist movement to oppose imperialist policies and military interventions."
2023-11-08 09:15:00,AUS_LAB,"The article mentions union-related concerns regarding the management transition of Junee Correctional Centre from GEO Group to the NSW government. Criticism was raised about the government's handling of the change, including alleged lack of consultation with the community and unions. Unions, specifically the Public Service Association, are implied to be involved in discussions with the government and to have a vested interest in the management and working conditions at the correctional facility. Opposition figures voiced concerns about potential impacts on unionized staff and budget implications. The transition has led to industrial actions by workers, highlighting ongoing union activity related to the prison's management change."
2023-11-08 19:00:00,AUS_LAB,"The article discusses the need for increased staffing and better working conditions for Services Australia employees, emphasizing the importance of valuing and supporting public servants. It highlights the stress caused by staffing shortages, inefficient processes, and high-pressure KPI targets, which negatively impact workers' well-being and service delivery. The recent announcement of 3,000 new staff is viewed as a positive step, but ongoing funding and broader cultural reforms are necessary. The article underscores the dedication of public servants and the need for improved working environments, addressing issues like micromanagement and workload pressures. Ultimately, it calls for government action to fix the agency’s broken system for the betterment of both employees and the public."
2023-11-08 19:15:00,AUS_LAB,"The article does not directly mention a labor union, but it highlights the struggles faced by Services Australia's workers, including inadequate staffing, poor working conditions, and the toxic, KPI-driven work environment. It emphasizes the need for ongoing staffing increases and better support for public servants, advocating for valuing and protecting their well-being. The workers are described as dedicated public servants who have played vital roles during crises, but are now under significant pressure and stress. Calls for improved management and cultural change within the agency suggest potential union involvement to advocate for workers' rights and better working conditions. Overall, the article underscores the importance of supporting and empowering public servants through structural and staffing reforms, which unions could potentially influence."
2023-11-08 19:30:00,AUS_LAB,"The article highlights the dire working conditions of Services Australia employees, emphasizing the need for increased staffing and better resourcing, which are issues often championed by labor unions. It describes the agency's reliance on KPIs that create perverse incentives, contributing to a toxic work environment and workplace stress, issues typically addressed by labor advocacy groups. Calls for ongoing funding and staffing increases reflect union demands for improved employee conditions and job security. The article advocates for valuing and supporting dedicated public servants, aligning with union efforts to enhance workforce conditions. Overall, it underscores the critical role of unions in advocating for the rights and well-being of public service workers amidst systemic challenges."
2023-11-08 19:30:00,AUS_LAB,"The article highlights the urgent need for increased staffing and better working conditions for Services Australia employees, who are experiencing a toxic, KPI-driven environment with excessive pressure and insufficient resources. It emphasizes the importance of valuing and supporting public servants, many of whom demonstrate dedication to helping Australians despite systemic issues. The recent announcement of 3,000 new staff is seen as a positive step, but ongoing funding and cultural reforms are necessary. The article also calls for addressing broader workplace concerns such as micromanagement and employee support, which are relevant to union efforts. Overall, it underscores the critical role of labor unions in advocating for improved conditions and staffing in the agency."
